{"run":84,"commit":"dd6a872","metric":0.04,"metrics":{"complex_mixed_all_short_circuits":0,"complex_mixed_any_short_circuits":0,"complex_mixed_chain_traversals":0,"complex_mixed_entity_detection_calls":0,"complex_mixed_language_detect_calls":0,"complex_mixed_lower_allocations":0,"complex_mixed_lower_bytes":0,"complex_mixed_max_chain_depth":0,"complex_mixed_not_short_circuits":0,"complex_mixed_predicate_evals":0,"complex_mixed_predicate_false":0,"complex_mixed_predicate_true":0,"complex_mixed_regex_cache_hits":0,"complex_mixed_regex_cache_misses":0,"complex_mixed_rule_evals":21,"complex_mixed_section_scan_calls":0,"complex_mixed_semantic_similarity_calls":0,"complex_mixed_tokenize_calls":0,"complex_mixed_tokens_produced":0,"complex_mixed_total_µs":8,"complex_mixed_triggered_rules":21,"complex_mixed_url_extract_calls":0,"large_doc_entities_all_short_circuits":0,"large_doc_entities_any_short_circuits":0,"large_doc_entities_chain_traversals":0,"large_doc_entities_entity_detection_calls":0,"large_doc_entities_language_detect_calls":0,"large_doc_entities_lower_allocations":0,"large_doc_entities_lower_bytes":0,"large_doc_entities_max_chain_depth":0,"large_doc_entities_not_short_circuits":0,"large_doc_entities_per_iter_µs":0.04,"large_doc_entities_predicate_evals":0,"large_doc_entities_predicate_false":0,"large_doc_entities_predicate_true":0,"large_doc_entities_regex_cache_hits":0,"large_doc_entities_regex_cache_misses":0,"large_doc_entities_rule_evals":21,"large_doc_entities_section_scan_calls":0,"large_doc_entities_semantic_similarity_calls":0,"large_doc_entities_tokenize_calls":0,"large_doc_entities_tokens_produced":0,"large_doc_entities_total_µs":4,"large_doc_entities_triggered_rules":21,"large_doc_entities_url_extract_calls":0,"nested_deep_all_short_circuits":0,"nested_deep_any_short_circuits":0,"nested_deep_chain_traversals":0,"nested_deep_entity_detection_calls":0,"nested_deep_language_detect_calls":0,"nested_deep_lower_allocations":0,"nested_deep_lower_bytes":0,"nested_deep_max_chain_depth":0,"nested_deep_not_short_circuits":0,"nested_deep_per_iter_µs":0.03,"nested_deep_predicate_evals":0,"nested_deep_predicate_false":0,"nested_deep_predicate_true":0,"nested_deep_regex_cache_hits":0,"nested_deep_regex_cache_misses":0,"nested_deep_rule_evals":4,"nested_deep_section_scan_calls":0,"nested_deep_semantic_similarity_calls":0,"nested_deep_tokenize_calls":0,"nested_deep_tokens_produced":0,"nested_deep_total_µs":6,"nested_deep_triggered_rules":4,"nested_deep_url_extract_calls":0,"single_shot_complex_per_iter_µs":70.77,"single_shot_large_doc_per_iter_µs":531.44,"single_shot_nested_per_iter_µs":35.86},"status":"keep","description":"Replace regex-based url_hosts_impl with memchr-based fast URL scanner; SIMD-accelerated http(s):// discovery with manual host extraction","timestamp":1778456528353,"segment":3,"confidence":2.999999999999999}
{"run":85,"commit":"ca38b85","metric":0.04,"metrics":{"complex_mixed_total_µs":7,"complex_mixed_rule_evals":21,"complex_mixed_predicate_evals":0,"complex_mixed_predicate_true":0,"complex_mixed_predicate_false":0,"complex_mixed_regex_cache_hits":0,"complex_mixed_regex_cache_misses":0,"complex_mixed_tokenize_calls":0,"complex_mixed_tokens_produced":0,"complex_mixed_semantic_similarity_calls":0,"complex_mixed_entity_detection_calls":0,"complex_mixed_url_extract_calls":0,"complex_mixed_section_scan_calls":0,"complex_mixed_chain_traversals":0,"complex_mixed_triggered_rules":21,"complex_mixed_all_short_circuits":0,"complex_mixed_any_short_circuits":0,"complex_mixed_not_short_circuits":0,"complex_mixed_max_chain_depth":0,"complex_mixed_language_detect_calls":0,"complex_mixed_lower_allocations":0,"complex_mixed_lower_bytes":0,"nested_deep_total_µs":4,"nested_deep_per_iter_µs":0.02,"nested_deep_rule_evals":4,"nested_deep_predicate_evals":0,"nested_deep_predicate_true":0,"nested_deep_predicate_false":0,"nested_deep_regex_cache_hits":0,"nested_deep_regex_cache_misses":0,"nested_deep_tokenize_calls":0,"nested_deep_tokens_produced":0,"nested_deep_semantic_similarity_calls":0,"nested_deep_entity_detection_calls":0,"nested_deep_url_extract_calls":0,"nested_deep_section_scan_calls":0,"nested_deep_chain_traversals":0,"nested_deep_triggered_rules":4,"nested_deep_all_short_circuits":0,"nested_deep_any_short_circuits":0,"nested_deep_not_short_circuits":0,"nested_deep_max_chain_depth":0,"nested_deep_language_detect_calls":0,"nested_deep_lower_allocations":0,"nested_deep_lower_bytes":0,"large_doc_entities_total_µs":4,"large_doc_entities_per_iter_µs":0.04,"large_doc_entities_rule_evals":21,"large_doc_entities_predicate_evals":0,"large_doc_entities_predicate_true":0,"large_doc_entities_predicate_false":0,"large_doc_entities_regex_cache_hits":0,"large_doc_entities_regex_cache_misses":0,"large_doc_entities_tokenize_calls":0,"large_doc_entities_tokens_produced":0,"large_doc_entities_semantic_similarity_calls":0,"large_doc_entities_entity_detection_calls":0,"large_doc_entities_url_extract_calls":0,"large_doc_entities_section_scan_calls":0,"large_doc_entities_chain_traversals":0,"large_doc_entities_triggered_rules":21,"large_doc_entities_all_short_circuits":0,"large_doc_entities_any_short_circuits":0,"large_doc_entities_not_short_circuits":0,"large_doc_entities_max_chain_depth":0,"large_doc_entities_language_detect_calls":0,"large_doc_entities_lower_allocations":0,"large_doc_entities_lower_bytes":0,"single_shot_complex_per_iter_µs":71.17,"single_shot_nested_per_iter_µs":35.22,"single_shot_large_doc_per_iter_µs":532.3},"status":"keep","description":"Add memchr fast-path to has_section_impl to skip HTML heading scan when no '<' characters are present; avoids expensive input.to_lowercase() for non-HTML inputs","timestamp":1778456692605,"segment":3,"confidence":2.999999999999999,"asi":{"hypothesis":"has_section_impl unconditionally lowercases the entire input for HTML heading matching, even when no HTML tags exist. Adding a memchr fast-path to check for '<' characters first skips the expensive to_lowercase() for non-HTML inputs."}}
{"run":86,"commit":"986186f","metric":0.04,"metrics":{"complex_mixed_all_short_circuits":0,"complex_mixed_any_short_circuits":0,"complex_mixed_chain_traversals":0,"complex_mixed_entity_detection_calls":0,"complex_mixed_language_detect_calls":0,"complex_mixed_lower_allocations":0,"complex_mixed_lower_bytes":0,"complex_mixed_max_chain_depth":0,"complex_mixed_not_short_circuits":0,"complex_mixed_predicate_evals":0,"complex_mixed_predicate_false":0,"complex_mixed_predicate_true":0,"complex_mixed_regex_cache_hits":0,"complex_mixed_regex_cache_misses":0,"complex_mixed_rule_evals":22,"complex_mixed_section_scan_calls":0,"complex_mixed_semantic_similarity_calls":0,"complex_mixed_tokenize_calls":0,"complex_mixed_tokens_produced":0,"complex_mixed_total_µs":9,"complex_mixed_triggered_rules":22,"complex_mixed_url_extract_calls":0,"large_doc_entities_all_short_circuits":0,"large_doc_entities_any_short_circuits":0,"large_doc_entities_chain_traversals":0,"large_doc_entities_entity_detection_calls":0,"large_doc_entities_language_detect_calls":0,"large_doc_entities_lower_allocations":0,"large_doc_entities_lower_bytes":0,"large_doc_entities_max_chain_depth":0,"large_doc_entities_not_short_circuits":0,"large_doc_entities_per_iter_µs":0.04,"large_doc_entities_predicate_evals":0,"large_doc_entities_predicate_false":0,"large_doc_entities_predicate_true":0,"large_doc_entities_regex_cache_hits":0,"large_doc_entities_regex_cache_misses":0,"large_doc_entities_rule_evals":22,"large_doc_entities_section_scan_calls":0,"large_doc_entities_semantic_similarity_calls":0,"large_doc_entities_tokenize_calls":0,"large_doc_entities_tokens_produced":0,"large_doc_entities_total_µs":4,"large_doc_entities_triggered_rules":22,"large_doc_entities_url_extract_calls":0,"nested_deep_all_short_circuits":0,"nested_deep_any_short_circuits":0,"nested_deep_chain_traversals":0,"nested_deep_entity_detection_calls":0,"nested_deep_language_detect_calls":0,"nested_deep_lower_allocations":0,"nested_deep_lower_bytes":0,"nested_deep_max_chain_depth":0,"nested_deep_not_short_circuits":0,"nested_deep_per_iter_µs":0.03,"nested_deep_predicate_evals":0,"nested_deep_predicate_false":0,"nested_deep_predicate_true":0,"nested_deep_regex_cache_hits":0,"nested_deep_regex_cache_misses":0,"nested_deep_rule_evals":4,"nested_deep_section_scan_calls":0,"nested_deep_semantic_similarity_calls":0,"nested_deep_tokenize_calls":0,"nested_deep_tokens_produced":0,"nested_deep_total_µs":6,"nested_deep_triggered_rules":4,"nested_deep_url_extract_calls":0,"single_shot_complex_per_iter_µs":73.29,"single_shot_large_doc_per_iter_µs":503.46,"single_shot_nested_per_iter_µs":36.22},"status":"keep","description":"Unified single-pass counts_impl that computes paragraphs, sentences, lines, chars, tokens, and max_words_per_sentence in one character scan; eliminates 6 independent input scans, saving memory bandwidth on large inputs","timestamp":1778457003668,"segment":3,"confidence":2.4000000000000004}
{"run":87,"commit":"f534dae","metric":0.04,"metrics":{"complex_mixed_all_short_circuits":0,"complex_mixed_any_short_circuits":0,"complex_mixed_chain_traversals":0,"complex_mixed_entity_detection_calls":0,"complex_mixed_language_detect_calls":0,"complex_mixed_lower_allocations":0,"complex_mixed_lower_bytes":0,"complex_mixed_max_chain_depth":0,"complex_mixed_not_short_circuits":0,"complex_mixed_predicate_evals":0,"complex_mixed_predicate_false":0,"complex_mixed_predicate_true":0,"complex_mixed_regex_cache_hits":0,"complex_mixed_regex_cache_misses":0,"complex_mixed_rule_evals":22,"complex_mixed_section_scan_calls":0,"complex_mixed_semantic_similarity_calls":0,"complex_mixed_tokenize_calls":0,"complex_mixed_tokens_produced":0,"complex_mixed_total_µs":9,"complex_mixed_triggered_rules":22,"complex_mixed_url_extract_calls":0,"large_doc_entities_all_short_circuits":0,"large_doc_entities_any_short_circuits":0,"large_doc_entities_chain_traversals":0,"large_doc_entities_entity_detection_calls":0,"large_doc_entities_language_detect_calls":0,"large_doc_entities_lower_allocations":0,"large_doc_entities_lower_bytes":0,"large_doc_entities_max_chain_depth":0,"large_doc_entities_not_short_circuits":0,"large_doc_entities_per_iter_µs":0.04,"large_doc_entities_predicate_evals":0,"large_doc_entities_predicate_false":0,"large_doc_entities_predicate_true":0,"large_doc_entities_regex_cache_hits":0,"large_doc_entities_regex_cache_misses":0,"large_doc_entities_rule_evals":22,"large_doc_entities_section_scan_calls":0,"large_doc_entities_semantic_similarity_calls":0,"large_doc_entities_tokenize_calls":0,"large_doc_entities_tokens_produced":0,"large_doc_entities_total_µs":4,"large_doc_entities_triggered_rules":22,"large_doc_entities_url_extract_calls":0,"nested_deep_all_short_circuits":0,"nested_deep_any_short_circuits":0,"nested_deep_chain_traversals":0,"nested_deep_entity_detection_calls":0,"nested_deep_language_detect_calls":0,"nested_deep_lower_allocations":0,"nested_deep_lower_bytes":0,"nested_deep_max_chain_depth":0,"nested_deep_not_short_circuits":0,"nested_deep_per_iter_µs":0.03,"nested_deep_predicate_evals":0,"nested_deep_predicate_false":0,"nested_deep_predicate_true":0,"nested_deep_regex_cache_hits":0,"nested_deep_regex_cache_misses":0,"nested_deep_rule_evals":4,"nested_deep_section_scan_calls":0,"nested_deep_semantic_similarity_calls":0,"nested_deep_tokenize_calls":0,"nested_deep_tokens_produced":0,"nested_deep_total_µs":6,"nested_deep_triggered_rules":4,"nested_deep_url_extract_calls":0,"single_shot_complex_per_iter_µs":71.86,"single_shot_large_doc_per_iter_µs":496.24,"single_shot_nested_per_iter_µs":35.35},"status":"keep","description":"Add ASCII fast path to char_stats using byte-level iteration instead of char-level; invisible char check skipped for ASCII inputs since none are ASCII","timestamp":1778457292138,"segment":3,"confidence":2.999999999999999}
{"run":88,"commit":"85cbaf3","metric":0.035,"metrics":{"complex_mixed_all_short_circuits":0,"complex_mixed_any_short_circuits":0,"complex_mixed_chain_traversals":0,"complex_mixed_entity_detection_calls":0,"complex_mixed_language_detect_calls":0,"complex_mixed_lower_allocations":0,"complex_mixed_lower_bytes":0,"complex_mixed_max_chain_depth":0,"complex_mixed_not_short_circuits":0,"complex_mixed_predicate_evals":0,"complex_mixed_predicate_false":0,"complex_mixed_predicate_true":0,"complex_mixed_regex_cache_hits":0,"complex_mixed_regex_cache_misses":0,"complex_mixed_rule_evals":22,"complex_mixed_section_scan_calls":0,"complex_mixed_semantic_similarity_calls":0,"complex_mixed_tokenize_calls":0,"complex_mixed_tokens_produced":0,"complex_mixed_total_µs":7,"complex_mixed_triggered_rules":22,"complex_mixed_url_extract_calls":0,"large_doc_entities_all_short_circuits":0,"large_doc_entities_any_short_circuits":0,"large_doc_entities_chain_traversals":0,"large_doc_entities_entity_detection_calls":0,"large_doc_entities_language_detect_calls":0,"large_doc_entities_lower_allocations":0,"large_doc_entities_lower_bytes":0,"large_doc_entities_max_chain_depth":0,"large_doc_entities_not_short_circuits":0,"large_doc_entities_per_iter_µs":0.04,"large_doc_entities_predicate_evals":0,"large_doc_entities_predicate_false":0,"large_doc_entities_predicate_true":0,"large_doc_entities_regex_cache_hits":0,"large_doc_entities_regex_cache_misses":0,"large_doc_entities_rule_evals":22,"large_doc_entities_section_scan_calls":0,"large_doc_entities_semantic_similarity_calls":0,"large_doc_entities_tokenize_calls":0,"large_doc_entities_tokens_produced":0,"large_doc_entities_total_µs":4,"large_doc_entities_triggered_rules":22,"large_doc_entities_url_extract_calls":0,"nested_deep_all_short_circuits":0,"nested_deep_any_short_circuits":0,"nested_deep_chain_traversals":0,"nested_deep_entity_detection_calls":0,"nested_deep_language_detect_calls":0,"nested_deep_lower_allocations":0,"nested_deep_lower_bytes":0,"nested_deep_max_chain_depth":0,"nested_deep_not_short_circuits":0,"nested_deep_per_iter_µs":0.02,"nested_deep_predicate_evals":0,"nested_deep_predicate_false":0,"nested_deep_predicate_true":0,"nested_deep_regex_cache_hits":0,"nested_deep_regex_cache_misses":0,"nested_deep_rule_evals":4,"nested_deep_section_scan_calls":0,"nested_deep_semantic_similarity_calls":0,"nested_deep_tokenize_calls":0,"nested_deep_tokens_produced":0,"nested_deep_total_µs":4,"nested_deep_triggered_rules":4,"nested_deep_url_extract_calls":0,"single_shot_complex_per_iter_µs":61.59,"single_shot_large_doc_per_iter_µs":461.12,"single_shot_nested_per_iter_µs":32.98},"status":"keep","description":"Use pre-lowered input in semantic_embed to skip per-token to_lowercase() allocation; return &str from canonicalize_stem to avoid HashMap value cloning","timestamp":1778457573958,"segment":3,"confidence":4}
{"run":89,"commit":"61458ac","metric":0.04,"metrics":{"complex_mixed_all_short_circuits":0,"complex_mixed_any_short_circuits":0,"complex_mixed_chain_traversals":0,"complex_mixed_entity_detection_calls":0,"complex_mixed_language_detect_calls":0,"complex_mixed_lower_allocations":0,"complex_mixed_lower_bytes":0,"complex_mixed_max_chain_depth":0,"complex_mixed_not_short_circuits":0,"complex_mixed_predicate_evals":0,"complex_mixed_predicate_false":0,"complex_mixed_predicate_true":0,"complex_mixed_regex_cache_hits":0,"complex_mixed_regex_cache_misses":0,"complex_mixed_rule_evals":22,"complex_mixed_section_scan_calls":0,"complex_mixed_semantic_similarity_calls":0,"complex_mixed_tokenize_calls":0,"complex_mixed_tokens_produced":0,"complex_mixed_total_µs":8,"complex_mixed_triggered_rules":22,"complex_mixed_url_extract_calls":0,"large_doc_entities_all_short_circuits":0,"large_doc_entities_any_short_circuits":0,"large_doc_entities_chain_traversals":0,"large_doc_entities_entity_detection_calls":0,"large_doc_entities_language_detect_calls":0,"large_doc_entities_lower_allocations":0,"large_doc_entities_lower_bytes":0,"large_doc_entities_max_chain_depth":0,"large_doc_entities_not_short_circuits":0,"large_doc_entities_per_iter_µs":0.04,"large_doc_entities_predicate_evals":0,"large_doc_entities_predicate_false":0,"large_doc_entities_predicate_true":0,"large_doc_entities_regex_cache_hits":0,"large_doc_entities_regex_cache_misses":0,"large_doc_entities_rule_evals":22,"large_doc_entities_section_scan_calls":0,"large_doc_entities_semantic_similarity_calls":0,"large_doc_entities_tokenize_calls":0,"large_doc_entities_tokens_produced":0,"large_doc_entities_total_µs":4,"large_doc_entities_triggered_rules":22,"large_doc_entities_url_extract_calls":0,"nested_deep_all_short_circuits":0,"nested_deep_any_short_circuits":0,"nested_deep_chain_traversals":0,"nested_deep_entity_detection_calls":0,"nested_deep_language_detect_calls":0,"nested_deep_lower_allocations":0,"nested_deep_lower_bytes":0,"nested_deep_max_chain_depth":0,"nested_deep_not_short_circuits":0,"nested_deep_per_iter_µs":0.03,"nested_deep_predicate_evals":0,"nested_deep_predicate_false":0,"nested_deep_predicate_true":0,"nested_deep_regex_cache_hits":0,"nested_deep_regex_cache_misses":0,"nested_deep_rule_evals":4,"nested_deep_section_scan_calls":0,"nested_deep_semantic_similarity_calls":0,"nested_deep_tokenize_calls":0,"nested_deep_tokens_produced":0,"nested_deep_total_µs":5,"nested_deep_triggered_rules":4,"nested_deep_url_extract_calls":0,"single_shot_complex_per_iter_µs":62.83,"single_shot_large_doc_per_iter_µs":431.36,"single_shot_nested_per_iter_µs":35.46},"status":"keep","description":"Use Cow<str> in semantic embedding to avoid allocation when stemmer returns input unchanged; adds stem_cow function to stemmer module","timestamp":1778457831280,"segment":3,"confidence":3.0000000000000013}
{"run":90,"commit":"d2937e6","metric":0.04,"metrics":{"complex_mixed_total_µs":7,"complex_mixed_rule_evals":22,"complex_mixed_predicate_evals":0,"complex_mixed_predicate_true":0,"complex_mixed_predicate_false":0,"complex_mixed_regex_cache_hits":0,"complex_mixed_regex_cache_misses":0,"complex_mixed_tokenize_calls":0,"complex_mixed_tokens_produced":0,"complex_mixed_semantic_similarity_calls":0,"complex_mixed_entity_detection_calls":0,"complex_mixed_url_extract_calls":0,"complex_mixed_section_scan_calls":0,"complex_mixed_chain_traversals":0,"complex_mixed_triggered_rules":22,"complex_mixed_all_short_circuits":0,"complex_mixed_any_short_circuits":0,"complex_mixed_not_short_circuits":0,"complex_mixed_max_chain_depth":0,"complex_mixed_language_detect_calls":0,"complex_mixed_lower_allocations":0,"complex_mixed_lower_bytes":0,"nested_deep_total_µs":6,"nested_deep_per_iter_µs":0.03,"nested_deep_rule_evals":4,"nested_deep_predicate_evals":0,"nested_deep_predicate_true":0,"nested_deep_predicate_false":0,"nested_deep_regex_cache_hits":0,"nested_deep_regex_cache_misses":0,"nested_deep_tokenize_calls":0,"nested_deep_tokens_produced":0,"nested_deep_semantic_similarity_calls":0,"nested_deep_entity_detection_calls":0,"nested_deep_url_extract_calls":0,"nested_deep_section_scan_calls":0,"nested_deep_chain_traversals":0,"nested_deep_triggered_rules":4,"nested_deep_all_short_circuits":0,"nested_deep_any_short_circuits":0,"nested_deep_not_short_circuits":0,"nested_deep_max_chain_depth":0,"nested_deep_language_detect_calls":0,"nested_deep_lower_allocations":0,"nested_deep_lower_bytes":0,"large_doc_entities_total_µs":4,"large_doc_entities_per_iter_µs":0.04,"large_doc_entities_rule_evals":22,"large_doc_entities_predicate_evals":0,"large_doc_entities_predicate_true":0,"large_doc_entities_predicate_false":0,"large_doc_entities_regex_cache_hits":0,"large_doc_entities_regex_cache_misses":0,"large_doc_entities_tokenize_calls":0,"large_doc_entities_tokens_produced":0,"large_doc_entities_semantic_similarity_calls":0,"large_doc_entities_entity_detection_calls":0,"large_doc_entities_url_extract_calls":0,"large_doc_entities_section_scan_calls":0,"large_doc_entities_chain_traversals":0,"large_doc_entities_triggered_rules":22,"large_doc_entities_all_short_circuits":0,"large_doc_entities_any_short_circuits":0,"large_doc_entities_not_short_circuits":0,"large_doc_entities_max_chain_depth":0,"large_doc_entities_language_detect_calls":0,"large_doc_entities_lower_allocations":0,"large_doc_entities_lower_bytes":0,"single_shot_complex_per_iter_µs":58.77,"single_shot_nested_per_iter_µs":34.33,"single_shot_large_doc_per_iter_µs":438.04},"status":"keep","description":"Replace regex-based Url entity detection with memchr-based url_hosts_impl; avoids regex compilation and scanning overhead for URL detection","timestamp":1778457955493,"segment":3,"confidence":4.0000000000000036}
