{"run":13,"commit":"2b84487","metric":96.64,"metrics":{"complex_mixed_all_short_circuits":0,"complex_mixed_any_short_circuits":0,"complex_mixed_chain_traversals":0,"complex_mixed_entity_detection_calls":9,"complex_mixed_language_detect_calls":0,"complex_mixed_lower_allocations":1,"complex_mixed_lower_bytes":1560,"complex_mixed_max_chain_depth":0,"complex_mixed_not_short_circuits":1,"complex_mixed_predicate_evals":33,"complex_mixed_predicate_false":11,"complex_mixed_predicate_true":20,"complex_mixed_regex_cache_hits":1,"complex_mixed_regex_cache_misses":0,"complex_mixed_rule_evals":32,"complex_mixed_section_scan_calls":1,"complex_mixed_semantic_similarity_calls":2,"complex_mixed_tokenize_calls":2,"complex_mixed_tokens_produced":490,"complex_mixed_total_µs":19329,"complex_mixed_triggered_rules":21,"complex_mixed_url_extract_calls":1,"large_doc_entities_all_short_circuits":0,"large_doc_entities_any_short_circuits":0,"large_doc_entities_chain_traversals":0,"large_doc_entities_entity_detection_calls":9,"large_doc_entities_language_detect_calls":0,"large_doc_entities_lower_allocations":1,"large_doc_entities_lower_bytes":11162,"large_doc_entities_max_chain_depth":0,"large_doc_entities_not_short_circuits":1,"large_doc_entities_per_iter_µs":693.24,"large_doc_entities_predicate_evals":33,"large_doc_entities_predicate_false":11,"large_doc_entities_predicate_true":20,"large_doc_entities_regex_cache_hits":1,"large_doc_entities_regex_cache_misses":0,"large_doc_entities_rule_evals":32,"large_doc_entities_section_scan_calls":1,"large_doc_entities_semantic_similarity_calls":2,"large_doc_entities_tokenize_calls":2,"large_doc_entities_tokens_produced":4892,"large_doc_entities_total_µs":69324,"large_doc_entities_triggered_rules":21,"large_doc_entities_url_extract_calls":1,"nested_deep_all_short_circuits":8,"nested_deep_any_short_circuits":2,"nested_deep_chain_traversals":0,"nested_deep_entity_detection_calls":2,"nested_deep_language_detect_calls":1,"nested_deep_lower_allocations":1,"nested_deep_lower_bytes":1560,"nested_deep_max_chain_depth":0,"nested_deep_not_short_circuits":1,"nested_deep_per_iter_µs":95.78,"nested_deep_predicate_evals":33,"nested_deep_predicate_false":16,"nested_deep_predicate_true":16,"nested_deep_regex_cache_hits":0,"nested_deep_regex_cache_misses":0,"nested_deep_rule_evals":9,"nested_deep_section_scan_calls":1,"nested_deep_semantic_similarity_calls":1,"nested_deep_tokenize_calls":0,"nested_deep_tokens_produced":0,"nested_deep_total_µs":19157,"nested_deep_triggered_rules":4,"nested_deep_url_extract_calls":1},"status":"keep","description":"Avoid format!(\".{d}\") allocation in HasUrlToDomain by manual byte comparison","timestamp":1777750363318,"segment":1,"confidence":16.005703422053237}
{"run":14,"commit":"967abce","metric":85.78,"metrics":{"complex_mixed_all_short_circuits":0,"complex_mixed_any_short_circuits":0,"complex_mixed_chain_traversals":0,"complex_mixed_entity_detection_calls":9,"complex_mixed_language_detect_calls":0,"complex_mixed_lower_allocations":1,"complex_mixed_lower_bytes":1560,"complex_mixed_max_chain_depth":0,"complex_mixed_not_short_circuits":1,"complex_mixed_predicate_evals":33,"complex_mixed_predicate_false":11,"complex_mixed_predicate_true":20,"complex_mixed_regex_cache_hits":1,"complex_mixed_regex_cache_misses":0,"complex_mixed_rule_evals":32,"complex_mixed_section_scan_calls":1,"complex_mixed_semantic_similarity_calls":2,"complex_mixed_tokenize_calls":2,"complex_mixed_tokens_produced":490,"complex_mixed_total_µs":17157,"complex_mixed_triggered_rules":21,"complex_mixed_url_extract_calls":1,"large_doc_entities_all_short_circuits":0,"large_doc_entities_any_short_circuits":0,"large_doc_entities_chain_traversals":0,"large_doc_entities_entity_detection_calls":9,"large_doc_entities_language_detect_calls":0,"large_doc_entities_lower_allocations":1,"large_doc_entities_lower_bytes":11162,"large_doc_entities_max_chain_depth":0,"large_doc_entities_not_short_circuits":1,"large_doc_entities_per_iter_µs":638.02,"large_doc_entities_predicate_evals":33,"large_doc_entities_predicate_false":11,"large_doc_entities_predicate_true":20,"large_doc_entities_regex_cache_hits":1,"large_doc_entities_regex_cache_misses":0,"large_doc_entities_rule_evals":32,"large_doc_entities_section_scan_calls":1,"large_doc_entities_semantic_similarity_calls":2,"large_doc_entities_tokenize_calls":2,"large_doc_entities_tokens_produced":4892,"large_doc_entities_total_µs":63802,"large_doc_entities_triggered_rules":21,"large_doc_entities_url_extract_calls":1,"nested_deep_all_short_circuits":8,"nested_deep_any_short_circuits":2,"nested_deep_chain_traversals":0,"nested_deep_entity_detection_calls":2,"nested_deep_language_detect_calls":1,"nested_deep_lower_allocations":1,"nested_deep_lower_bytes":1560,"nested_deep_max_chain_depth":0,"nested_deep_not_short_circuits":1,"nested_deep_per_iter_µs":85.55,"nested_deep_predicate_evals":33,"nested_deep_predicate_false":16,"nested_deep_predicate_true":16,"nested_deep_regex_cache_hits":0,"nested_deep_regex_cache_misses":0,"nested_deep_rule_evals":9,"nested_deep_section_scan_calls":1,"nested_deep_semantic_similarity_calls":1,"nested_deep_tokenize_calls":0,"nested_deep_tokens_produced":0,"nested_deep_total_µs":17110,"nested_deep_triggered_rules":4,"nested_deep_url_extract_calls":1},"status":"keep","description":"Fast-path shannon_entropy for ASCII strings using [0u32;128] instead of HashMap","timestamp":1777750437463,"segment":1,"confidence":14.573899371069183}
{"run":15,"commit":"59669e2","metric":92.83,"metrics":{"complex_mixed_total_µs":18566,"complex_mixed_rule_evals":32,"complex_mixed_predicate_evals":33,"complex_mixed_predicate_true":20,"complex_mixed_predicate_false":11,"complex_mixed_regex_cache_hits":1,"complex_mixed_regex_cache_misses":0,"complex_mixed_tokenize_calls":2,"complex_mixed_tokens_produced":490,"complex_mixed_semantic_similarity_calls":2,"complex_mixed_entity_detection_calls":9,"complex_mixed_url_extract_calls":1,"complex_mixed_section_scan_calls":1,"complex_mixed_chain_traversals":0,"complex_mixed_triggered_rules":21,"complex_mixed_all_short_circuits":0,"complex_mixed_any_short_circuits":0,"complex_mixed_not_short_circuits":1,"complex_mixed_max_chain_depth":0,"complex_mixed_language_detect_calls":0,"complex_mixed_lower_allocations":1,"complex_mixed_lower_bytes":1560,"nested_deep_total_µs":17975,"nested_deep_per_iter_µs":89.875,"nested_deep_rule_evals":9,"nested_deep_predicate_evals":33,"nested_deep_predicate_true":16,"nested_deep_predicate_false":16,"nested_deep_regex_cache_hits":0,"nested_deep_regex_cache_misses":0,"nested_deep_tokenize_calls":0,"nested_deep_tokens_produced":0,"nested_deep_semantic_similarity_calls":1,"nested_deep_entity_detection_calls":2,"nested_deep_url_extract_calls":1,"nested_deep_section_scan_calls":1,"nested_deep_chain_traversals":0,"nested_deep_triggered_rules":4,"nested_deep_all_short_circuits":8,"nested_deep_any_short_circuits":2,"nested_deep_not_short_circuits":1,"nested_deep_max_chain_depth":0,"nested_deep_language_detect_calls":1,"nested_deep_lower_allocations":1,"nested_deep_lower_bytes":1560,"large_doc_entities_total_µs":67945,"large_doc_entities_per_iter_µs":679.45,"large_doc_entities_rule_evals":32,"large_doc_entities_predicate_evals":33,"large_doc_entities_predicate_true":20,"large_doc_entities_predicate_false":11,"large_doc_entities_regex_cache_hits":1,"large_doc_entities_regex_cache_misses":0,"large_doc_entities_tokenize_calls":2,"large_doc_entities_tokens_produced":4892,"large_doc_entities_semantic_similarity_calls":2,"large_doc_entities_entity_detection_calls":9,"large_doc_entities_url_extract_calls":1,"large_doc_entities_section_scan_calls":1,"large_doc_entities_chain_traversals":0,"large_doc_entities_triggered_rules":21,"large_doc_entities_all_short_circuits":0,"large_doc_entities_any_short_circuits":0,"large_doc_entities_not_short_circuits":1,"large_doc_entities_max_chain_depth":0,"large_doc_entities_language_detect_calls":0,"large_doc_entities_lower_allocations":1,"large_doc_entities_lower_bytes":11162},"status":"keep","description":"ASCII fast-path to_ascii_lowercase() + pre-process has_section titles + avoid format!/to_string in has_section","timestamp":1778427986463,"segment":1,"confidence":18.22812192723697,"asi":{"changes":"1. Ctx::new uses to_ascii_lowercase() for ASCII inputs. 2. dsl.rs pre-trims and pre-lowercases HasSection titles. 3. has_section uses static HTML tag arrays instead of format!. 4. Avoids to_string allocation in HTML body comparison.","hypothesis":"1. ASCII inputs are common; to_ascii_lowercase() is faster than to_lowercase(). 2. Pre-processing has_section titles at compile time saves per-eval allocations. 3. Avoiding format! and to_string in HTML heading scan saves allocations.","result":"complex_mixed improved 124->93µs (-25%). nested_deep 94->90µs (-4%). large_doc_entities 653->679µs (+4%, possibly noise)."}}
{"run":16,"commit":"not com","metric":122.29,"metrics":{"complex_mixed_total_µs":24458,"complex_mixed_rule_evals":32,"complex_mixed_predicate_evals":33,"complex_mixed_predicate_true":20,"complex_mixed_predicate_false":11,"complex_mixed_regex_cache_hits":1,"complex_mixed_regex_cache_misses":0,"complex_mixed_tokenize_calls":2,"complex_mixed_tokens_produced":490,"complex_mixed_semantic_similarity_calls":2,"complex_mixed_entity_detection_calls":9,"complex_mixed_url_extract_calls":1,"complex_mixed_section_scan_calls":1,"complex_mixed_chain_traversals":0,"complex_mixed_triggered_rules":21,"complex_mixed_all_short_circuits":0,"complex_mixed_any_short_circuits":0,"complex_mixed_not_short_circuits":1,"complex_mixed_max_chain_depth":0,"complex_mixed_language_detect_calls":0,"complex_mixed_lower_allocations":1,"complex_mixed_lower_bytes":1560,"nested_deep_total_µs":19369,"nested_deep_per_iter_µs":96.845,"nested_deep_rule_evals":9,"nested_deep_predicate_evals":33,"nested_deep_predicate_true":16,"nested_deep_predicate_false":16,"nested_deep_regex_cache_hits":0,"nested_deep_regex_cache_misses":0,"nested_deep_tokenize_calls":0,"nested_deep_tokens_produced":0,"nested_deep_semantic_similarity_calls":1,"nested_deep_entity_detection_calls":2,"nested_deep_url_extract_calls":1,"nested_deep_section_scan_calls":1,"nested_deep_chain_traversals":0,"nested_deep_triggered_rules":4,"nested_deep_all_short_circuits":8,"nested_deep_any_short_circuits":2,"nested_deep_not_short_circuits":1,"nested_deep_max_chain_depth":0,"nested_deep_language_detect_calls":1,"nested_deep_lower_allocations":1,"nested_deep_lower_bytes":1560,"large_doc_entities_total_µs":66798,"large_doc_entities_per_iter_µs":667.98,"large_doc_entities_rule_evals":32,"large_doc_entities_predicate_evals":33,"large_doc_entities_predicate_true":20,"large_doc_entities_predicate_false":11,"large_doc_entities_regex_cache_hits":1,"large_doc_entities_regex_cache_misses":0,"large_doc_entities_tokenize_calls":2,"large_doc_entities_tokens_produced":4892,"large_doc_entities_semantic_similarity_calls":2,"large_doc_entities_entity_detection_calls":9,"large_doc_entities_url_extract_calls":1,"large_doc_entities_section_scan_calls":1,"large_doc_entities_chain_traversals":0,"large_doc_entities_triggered_rules":21,"large_doc_entities_all_short_circuits":0,"large_doc_entities_any_short_circuits":0,"large_doc_entities_not_short_circuits":1,"large_doc_entities_max_chain_depth":0,"large_doc_entities_language_detect_calls":0,"large_doc_entities_lower_allocations":1,"large_doc_entities_lower_bytes":11162},"status":"discard","description":"Pre-compute semantic example embeddings in Predicate::SemanticMatch (flat Vec + unsafe cast)","timestamp":1778428631736,"segment":1,"confidence":11.868117797695259,"asi":{"hypothesis":"Pre-computing example embeddings at compile time avoids tokenization/stemming/hashing per evaluation.","rollback_reason":"Significant regression on complex_mixed (92->122µs) and mixed results on nested_deep/large_doc. Storing flat Vec in Predicate increases memory footprint and hurts cache locality for deep predicate trees. Benefit is small for short examples.","next_action_hint":"Avoid embedding pre-computation inside Predicate enum. Instead explore: 1) global thread-local cache for example embeddings keyed by (text, lang, extra_hash). 2) WASM-specific optimizations like opt-level=3. 3) Reduce Predicate enum size by boxing large variants."}}
{"run":17,"commit":"9520d39","metric":85.66,"metrics":{"complex_mixed_total_µs":17132,"complex_mixed_rule_evals":32,"complex_mixed_predicate_evals":33,"complex_mixed_predicate_true":20,"complex_mixed_predicate_false":11,"complex_mixed_regex_cache_hits":1,"complex_mixed_regex_cache_misses":0,"complex_mixed_tokenize_calls":2,"complex_mixed_tokens_produced":490,"complex_mixed_semantic_similarity_calls":2,"complex_mixed_entity_detection_calls":9,"complex_mixed_url_extract_calls":1,"complex_mixed_section_scan_calls":1,"complex_mixed_chain_traversals":0,"complex_mixed_triggered_rules":21,"complex_mixed_all_short_circuits":0,"complex_mixed_any_short_circuits":0,"complex_mixed_not_short_circuits":1,"complex_mixed_max_chain_depth":0,"complex_mixed_language_detect_calls":0,"complex_mixed_lower_allocations":1,"complex_mixed_lower_bytes":1560,"nested_deep_total_µs":17105,"nested_deep_per_iter_µs":85.525,"nested_deep_rule_evals":9,"nested_deep_predicate_evals":33,"nested_deep_predicate_true":16,"nested_deep_predicate_false":16,"nested_deep_regex_cache_hits":0,"nested_deep_regex_cache_misses":0,"nested_deep_tokenize_calls":0,"nested_deep_tokens_produced":0,"nested_deep_semantic_similarity_calls":1,"nested_deep_entity_detection_calls":2,"nested_deep_url_extract_calls":1,"nested_deep_section_scan_calls":1,"nested_deep_chain_traversals":0,"nested_deep_triggered_rules":4,"nested_deep_all_short_circuits":8,"nested_deep_any_short_circuits":2,"nested_deep_not_short_circuits":1,"nested_deep_max_chain_depth":0,"nested_deep_language_detect_calls":1,"nested_deep_lower_allocations":1,"nested_deep_lower_bytes":1560,"large_doc_entities_total_µs":64843,"large_doc_entities_per_iter_µs":648.43,"large_doc_entities_rule_evals":32,"large_doc_entities_predicate_evals":33,"large_doc_entities_predicate_true":20,"large_doc_entities_predicate_false":11,"large_doc_entities_regex_cache_hits":1,"large_doc_entities_regex_cache_misses":0,"large_doc_entities_tokenize_calls":2,"large_doc_entities_tokens_produced":4892,"large_doc_entities_semantic_similarity_calls":2,"large_doc_entities_entity_detection_calls":9,"large_doc_entities_url_extract_calls":1,"large_doc_entities_section_scan_calls":1,"large_doc_entities_chain_traversals":0,"large_doc_entities_triggered_rules":21,"large_doc_entities_all_short_circuits":0,"large_doc_entities_any_short_circuits":0,"large_doc_entities_not_short_circuits":1,"large_doc_entities_max_chain_depth":0,"large_doc_entities_language_detect_calls":0,"large_doc_entities_lower_allocations":1,"large_doc_entities_lower_bytes":11162},"status":"keep","description":"Pre-compute chained_targets in Program with serde(skip) to avoid per-evaluate HashSet allocation","timestamp":1778428773732,"segment":1,"confidence":9.942153186930904,"asi":{"changes":"1. Added `chained_targets: Vec<String>` to `Program` with `#[serde(skip, default)]`. 2. Computed it in `dsl::parse` and `decode`. 3. Replaced per-evaluate `HashSet<&str>` construction with `program.chained_targets.contains(&rule.id)` in `evaluate`.","hypothesis":"Building a HashSet on every evaluate call is unnecessary overhead. Pre-computing it once during parsing/decoding saves allocation and iteration.","result":"All benchmarks improved: complex_mixed -7.7%, nested_deep -4.8%, large_doc_entities -4.6%."}}
{"run":18,"commit":"88f9b2f","metric":89.1,"metrics":{"complex_mixed_all_short_circuits":0,"complex_mixed_any_short_circuits":0,"complex_mixed_chain_traversals":0,"complex_mixed_entity_detection_calls":9,"complex_mixed_language_detect_calls":0,"complex_mixed_lower_allocations":1,"complex_mixed_lower_bytes":1560,"complex_mixed_max_chain_depth":0,"complex_mixed_not_short_circuits":1,"complex_mixed_predicate_evals":33,"complex_mixed_predicate_false":11,"complex_mixed_predicate_true":20,"complex_mixed_regex_cache_hits":1,"complex_mixed_regex_cache_misses":0,"complex_mixed_rule_evals":32,"complex_mixed_section_scan_calls":1,"complex_mixed_semantic_similarity_calls":2,"complex_mixed_tokenize_calls":2,"complex_mixed_tokens_produced":490,"complex_mixed_total_µs":17820,"complex_mixed_triggered_rules":21,"complex_mixed_url_extract_calls":1,"large_doc_entities_all_short_circuits":0,"large_doc_entities_any_short_circuits":0,"large_doc_entities_chain_traversals":0,"large_doc_entities_entity_detection_calls":9,"large_doc_entities_language_detect_calls":0,"large_doc_entities_lower_allocations":1,"large_doc_entities_lower_bytes":11162,"large_doc_entities_max_chain_depth":0,"large_doc_entities_not_short_circuits":1,"large_doc_entities_per_iter_µs":670.62,"large_doc_entities_predicate_evals":33,"large_doc_entities_predicate_false":11,"large_doc_entities_predicate_true":20,"large_doc_entities_regex_cache_hits":1,"large_doc_entities_regex_cache_misses":0,"large_doc_entities_rule_evals":32,"large_doc_entities_section_scan_calls":1,"large_doc_entities_semantic_similarity_calls":2,"large_doc_entities_tokenize_calls":2,"large_doc_entities_tokens_produced":4892,"large_doc_entities_total_µs":67062,"large_doc_entities_triggered_rules":21,"large_doc_entities_url_extract_calls":1,"nested_deep_all_short_circuits":8,"nested_deep_any_short_circuits":2,"nested_deep_chain_traversals":0,"nested_deep_entity_detection_calls":2,"nested_deep_language_detect_calls":1,"nested_deep_lower_allocations":1,"nested_deep_lower_bytes":1560,"nested_deep_max_chain_depth":0,"nested_deep_not_short_circuits":1,"nested_deep_per_iter_µs":91.39,"nested_deep_predicate_evals":33,"nested_deep_predicate_false":16,"nested_deep_predicate_true":16,"nested_deep_regex_cache_hits":0,"nested_deep_regex_cache_misses":0,"nested_deep_rule_evals":9,"nested_deep_section_scan_calls":1,"nested_deep_semantic_similarity_calls":1,"nested_deep_tokenize_calls":0,"nested_deep_tokens_produced":0,"nested_deep_total_µs":18278,"nested_deep_triggered_rules":4,"nested_deep_url_extract_calls":1},"status":"keep","description":"Sort predicates inside All/Any by cost_estimate at compile time for earlier short-circuiting","timestamp":1778429429228,"segment":1,"confidence":12.309018567639248,"asi":{"changes":"Added `Predicate::cost_estimate()` in `ir.rs` and sorted inner predicates by cost in `dsl.rs` when constructing `All`/`Any`.","hypothesis":"Evaluating cheaper predicates first in `All`/`Any` leads to earlier short-circuiting, skipping expensive predicates (entity detection, semantic match, regex) when possible.","result":"complex_mixed -4.4%, nested_deep -2.3%, large_doc_entities -4.3%."}}
{"run":19,"commit":"a505015","metric":87.4,"metrics":{"complex_mixed_all_short_circuits":0,"complex_mixed_any_short_circuits":0,"complex_mixed_chain_traversals":0,"complex_mixed_entity_detection_calls":9,"complex_mixed_language_detect_calls":0,"complex_mixed_lower_allocations":1,"complex_mixed_lower_bytes":1560,"complex_mixed_max_chain_depth":0,"complex_mixed_not_short_circuits":1,"complex_mixed_predicate_evals":33,"complex_mixed_predicate_false":11,"complex_mixed_predicate_true":20,"complex_mixed_regex_cache_hits":1,"complex_mixed_regex_cache_misses":0,"complex_mixed_rule_evals":32,"complex_mixed_section_scan_calls":1,"complex_mixed_semantic_similarity_calls":2,"complex_mixed_tokenize_calls":2,"complex_mixed_tokens_produced":490,"complex_mixed_total_µs":17480,"complex_mixed_triggered_rules":21,"complex_mixed_url_extract_calls":1,"large_doc_entities_all_short_circuits":0,"large_doc_entities_any_short_circuits":0,"large_doc_entities_chain_traversals":0,"large_doc_entities_entity_detection_calls":9,"large_doc_entities_language_detect_calls":0,"large_doc_entities_lower_allocations":1,"large_doc_entities_lower_bytes":11162,"large_doc_entities_max_chain_depth":0,"large_doc_entities_not_short_circuits":1,"large_doc_entities_per_iter_µs":660,"large_doc_entities_predicate_evals":33,"large_doc_entities_predicate_false":11,"large_doc_entities_predicate_true":20,"large_doc_entities_regex_cache_hits":1,"large_doc_entities_regex_cache_misses":0,"large_doc_entities_rule_evals":32,"large_doc_entities_section_scan_calls":1,"large_doc_entities_semantic_similarity_calls":2,"large_doc_entities_tokenize_calls":2,"large_doc_entities_tokens_produced":4892,"large_doc_entities_total_µs":66000,"large_doc_entities_triggered_rules":21,"large_doc_entities_url_extract_calls":1,"nested_deep_all_short_circuits":8,"nested_deep_any_short_circuits":2,"nested_deep_chain_traversals":0,"nested_deep_entity_detection_calls":2,"nested_deep_language_detect_calls":1,"nested_deep_lower_allocations":1,"nested_deep_lower_bytes":1560,"nested_deep_max_chain_depth":0,"nested_deep_not_short_circuits":1,"nested_deep_per_iter_µs":87.3,"nested_deep_predicate_evals":33,"nested_deep_predicate_false":16,"nested_deep_predicate_true":16,"nested_deep_regex_cache_hits":0,"nested_deep_regex_cache_misses":0,"nested_deep_rule_evals":9,"nested_deep_section_scan_calls":1,"nested_deep_semantic_similarity_calls":1,"nested_deep_tokenize_calls":0,"nested_deep_tokens_produced":0,"nested_deep_total_µs":17460,"nested_deep_triggered_rules":4,"nested_deep_url_extract_calls":1},"status":"keep","description":"Fix entity count cache key to include min_count, preventing incorrect cached results when same entity kind is checked with different thresholds","timestamp":1778429645854,"segment":1,"confidence":12.872399445214965,"asi":{"changes":"Changed entity_counts cache key from EntityKind to (EntityKind, u32).","hypothesis":"The old cache used only EntityKind as key, so count_entities_impl(min_count=1) could return 0/1 from is_match short-circuit and be reused for min_count=2. Including min_count in the key fixes this.","result":"Slight improvement across all benchmarks (~1-4%). More importantly fixes correctness bug."}}
