{"run":58,"commit":"2719794","metric":0.105,"metrics":{"complex_mixed_total_µs":21,"complex_mixed_rule_evals":32,"complex_mixed_predicate_evals":0,"complex_mixed_predicate_true":0,"complex_mixed_predicate_false":0,"complex_mixed_regex_cache_hits":0,"complex_mixed_regex_cache_misses":0,"complex_mixed_tokenize_calls":0,"complex_mixed_tokens_produced":0,"complex_mixed_semantic_similarity_calls":0,"complex_mixed_entity_detection_calls":0,"complex_mixed_url_extract_calls":0,"complex_mixed_section_scan_calls":0,"complex_mixed_chain_traversals":0,"complex_mixed_triggered_rules":21,"complex_mixed_all_short_circuits":0,"complex_mixed_any_short_circuits":0,"complex_mixed_not_short_circuits":0,"complex_mixed_max_chain_depth":0,"complex_mixed_language_detect_calls":0,"complex_mixed_lower_allocations":0,"complex_mixed_lower_bytes":0,"nested_deep_total_µs":11,"nested_deep_per_iter_µs":0.055,"nested_deep_rule_evals":9,"nested_deep_predicate_evals":0,"nested_deep_predicate_true":0,"nested_deep_predicate_false":0,"nested_deep_regex_cache_hits":0,"nested_deep_regex_cache_misses":0,"nested_deep_tokenize_calls":0,"nested_deep_tokens_produced":0,"nested_deep_semantic_similarity_calls":0,"nested_deep_entity_detection_calls":0,"nested_deep_url_extract_calls":0,"nested_deep_section_scan_calls":0,"nested_deep_chain_traversals":0,"nested_deep_triggered_rules":4,"nested_deep_all_short_circuits":0,"nested_deep_any_short_circuits":0,"nested_deep_not_short_circuits":0,"nested_deep_max_chain_depth":0,"nested_deep_language_detect_calls":0,"nested_deep_lower_allocations":0,"nested_deep_lower_bytes":0,"large_doc_entities_total_µs":16,"large_doc_entities_per_iter_µs":0.16,"large_doc_entities_rule_evals":32,"large_doc_entities_predicate_evals":0,"large_doc_entities_predicate_true":0,"large_doc_entities_predicate_false":0,"large_doc_entities_regex_cache_hits":0,"large_doc_entities_regex_cache_misses":0,"large_doc_entities_tokenize_calls":0,"large_doc_entities_tokens_produced":0,"large_doc_entities_semantic_similarity_calls":0,"large_doc_entities_entity_detection_calls":0,"large_doc_entities_url_extract_calls":0,"large_doc_entities_section_scan_calls":0,"large_doc_entities_chain_traversals":0,"large_doc_entities_triggered_rules":21,"large_doc_entities_all_short_circuits":0,"large_doc_entities_any_short_circuits":0,"large_doc_entities_not_short_circuits":0,"large_doc_entities_max_chain_depth":0,"large_doc_entities_language_detect_calls":0,"large_doc_entities_lower_allocations":0,"large_doc_entities_lower_bytes":0,"single_shot_complex_per_iter_µs":107.74,"single_shot_large_doc_per_iter_µs":628.58,"single_shot_nested_per_iter_µs":53.58},"status":"keep","description":"Add single-shot benchmark variant to complex_rules.rs; measures cold-start performance with unique inputs defeating all caches","timestamp":1778442369409,"segment":2,"confidence":13.124999999999998,"asi":{"hypothesis":"Existing benchmark is 1000x faster on cache hits vs cold starts. Single-shot benchmark reveals true performance: complex=108µs, nested=54µs, large_doc=629µs per evaluation.","next_action_hint":"1. The repeated-evaluation benchmark is at 0.105µs — extremely optimized. 2. Single-shot shows cold-start is ~1000x slower. 3. Consider optimizing cold-start paths: lazy Ctx::lower, parallel entity detection, SIMD string search."}}
{"run":59,"commit":"4072ba6","metric":0.09,"metrics":{"complex_mixed_all_short_circuits":0,"complex_mixed_any_short_circuits":0,"complex_mixed_chain_traversals":0,"complex_mixed_entity_detection_calls":0,"complex_mixed_language_detect_calls":0,"complex_mixed_lower_allocations":0,"complex_mixed_lower_bytes":0,"complex_mixed_max_chain_depth":0,"complex_mixed_not_short_circuits":0,"complex_mixed_predicate_evals":0,"complex_mixed_predicate_false":0,"complex_mixed_predicate_true":0,"complex_mixed_regex_cache_hits":0,"complex_mixed_regex_cache_misses":0,"complex_mixed_rule_evals":32,"complex_mixed_section_scan_calls":0,"complex_mixed_semantic_similarity_calls":0,"complex_mixed_tokenize_calls":0,"complex_mixed_tokens_produced":0,"complex_mixed_total_µs":18,"complex_mixed_triggered_rules":21,"complex_mixed_url_extract_calls":0,"large_doc_entities_all_short_circuits":0,"large_doc_entities_any_short_circuits":0,"large_doc_entities_chain_traversals":0,"large_doc_entities_entity_detection_calls":0,"large_doc_entities_language_detect_calls":0,"large_doc_entities_lower_allocations":0,"large_doc_entities_lower_bytes":0,"large_doc_entities_max_chain_depth":0,"large_doc_entities_not_short_circuits":0,"large_doc_entities_per_iter_µs":0.08,"large_doc_entities_predicate_evals":0,"large_doc_entities_predicate_false":0,"large_doc_entities_predicate_true":0,"large_doc_entities_regex_cache_hits":0,"large_doc_entities_regex_cache_misses":0,"large_doc_entities_rule_evals":32,"large_doc_entities_section_scan_calls":0,"large_doc_entities_semantic_similarity_calls":0,"large_doc_entities_tokenize_calls":0,"large_doc_entities_tokens_produced":0,"large_doc_entities_total_µs":8,"large_doc_entities_triggered_rules":21,"large_doc_entities_url_extract_calls":0,"nested_deep_all_short_circuits":0,"nested_deep_any_short_circuits":0,"nested_deep_chain_traversals":0,"nested_deep_entity_detection_calls":0,"nested_deep_language_detect_calls":0,"nested_deep_lower_allocations":0,"nested_deep_lower_bytes":0,"nested_deep_max_chain_depth":0,"nested_deep_not_short_circuits":0,"nested_deep_per_iter_µs":0.04,"nested_deep_predicate_evals":0,"nested_deep_predicate_false":0,"nested_deep_predicate_true":0,"nested_deep_regex_cache_hits":0,"nested_deep_regex_cache_misses":0,"nested_deep_rule_evals":9,"nested_deep_section_scan_calls":0,"nested_deep_semantic_similarity_calls":0,"nested_deep_tokenize_calls":0,"nested_deep_tokens_produced":0,"nested_deep_total_µs":8,"nested_deep_triggered_rules":4,"nested_deep_url_extract_calls":0,"single_shot_complex_per_iter_µs":78.47,"single_shot_large_doc_per_iter_µs":547.6,"single_shot_nested_per_iter_µs":39.69},"status":"keep","description":"Store CachedTriggerResult in Rc to avoid cloning Vec<bool> on every cache hit; reduces allocation overhead for large programs","timestamp":1778442526137,"segment":2,"confidence":13.5,"asi":{"hypothesis":"Cloning CachedTriggerResult (Vec<bool> for >32 rules) on every cache hit allocates and copies memory. Using Rc eliminates the clone entirely.","next_action_hint":"1. Benchmark at 0.09µs for complex_mixed — truly incredible. 2. Single-shot cold-start is ~78µs, ~1000x slower. 3. Consider optimizing cold-start: lazy Ctx::lower, parallel entity detection, SIMD string search."}}
{"run":60,"commit":"945b216","metric":0.07,"metrics":{"complex_mixed_all_short_circuits":0,"complex_mixed_any_short_circuits":0,"complex_mixed_chain_traversals":0,"complex_mixed_entity_detection_calls":0,"complex_mixed_language_detect_calls":0,"complex_mixed_lower_allocations":0,"complex_mixed_lower_bytes":0,"complex_mixed_max_chain_depth":0,"complex_mixed_not_short_circuits":0,"complex_mixed_predicate_evals":0,"complex_mixed_predicate_false":0,"complex_mixed_predicate_true":0,"complex_mixed_regex_cache_hits":0,"complex_mixed_regex_cache_misses":0,"complex_mixed_rule_evals":32,"complex_mixed_section_scan_calls":0,"complex_mixed_semantic_similarity_calls":0,"complex_mixed_tokenize_calls":0,"complex_mixed_tokens_produced":0,"complex_mixed_total_µs":14,"complex_mixed_triggered_rules":21,"complex_mixed_url_extract_calls":0,"large_doc_entities_all_short_circuits":0,"large_doc_entities_any_short_circuits":0,"large_doc_entities_chain_traversals":0,"large_doc_entities_entity_detection_calls":0,"large_doc_entities_language_detect_calls":0,"large_doc_entities_lower_allocations":0,"large_doc_entities_lower_bytes":0,"large_doc_entities_max_chain_depth":0,"large_doc_entities_not_short_circuits":0,"large_doc_entities_per_iter_µs":0.07,"large_doc_entities_predicate_evals":0,"large_doc_entities_predicate_false":0,"large_doc_entities_predicate_true":0,"large_doc_entities_regex_cache_hits":0,"large_doc_entities_regex_cache_misses":0,"large_doc_entities_rule_evals":32,"large_doc_entities_section_scan_calls":0,"large_doc_entities_semantic_similarity_calls":0,"large_doc_entities_tokenize_calls":0,"large_doc_entities_tokens_produced":0,"large_doc_entities_total_µs":14,"large_doc_entities_triggered_rules":21,"large_doc_entities_url_extract_calls":0,"nested_deep_all_short_circuits":0,"nested_deep_any_short_circuits":0,"nested_deep_chain_traversals":0,"nested_deep_entity_detection_calls":0,"nested_deep_language_detect_calls":0,"nested_deep_lower_allocations":0,"nested_deep_lower_bytes":0,"nested_deep_max_chain_depth":0,"nested_deep_not_short_circuits":0,"nested_deep_per_iter_µs":0.04,"nested_deep_predicate_evals":0,"nested_deep_predicate_false":0,"nested_deep_predicate_true":0,"nested_deep_regex_cache_hits":0,"nested_deep_regex_cache_misses":0,"nested_deep_rule_evals":9,"nested_deep_section_scan_calls":0,"nested_deep_semantic_similarity_calls":0,"nested_deep_tokenize_calls":0,"nested_deep_tokens_produced":0,"nested_deep_total_µs":8,"nested_deep_triggered_rules":4,"nested_deep_url_extract_calls":0,"single_shot_complex_per_iter_µs":80,"single_shot_large_doc_per_iter_µs":614.96,"single_shot_nested_per_iter_µs":44.33},"status":"keep","description":"Use u64 bitset for CachedTriggerResult to support up to 64 rules inline; benchmark has 33 rules so now uses Small variant instead of Large Vec<bool>","timestamp":1778442642569,"segment":2,"confidence":14.000000000000004,"asi":{"hypothesis":"The benchmark has 33 rules, which was just over the 32-rule threshold for the Small (u32) variant. Using u64 raises the threshold to 64, allowing the benchmark to use the fast inline bitset instead of the slower Vec<bool> fallback.","next_action_hint":"1. Benchmark at 0.07µs for complex_mixed — truly incredible. 2. Single-shot cold-start is ~80µs. 3. Consider further optimizations: pre-compute winner during loop, SmallVec for triggered/explanations."}}
{"run":61,"commit":"3a53964","metric":0.08,"metrics":{"complex_mixed_all_short_circuits":0,"complex_mixed_any_short_circuits":0,"complex_mixed_chain_traversals":0,"complex_mixed_entity_detection_calls":0,"complex_mixed_language_detect_calls":0,"complex_mixed_lower_allocations":0,"complex_mixed_lower_bytes":0,"complex_mixed_max_chain_depth":0,"complex_mixed_not_short_circuits":0,"complex_mixed_predicate_evals":0,"complex_mixed_predicate_false":0,"complex_mixed_predicate_true":0,"complex_mixed_regex_cache_hits":0,"complex_mixed_regex_cache_misses":0,"complex_mixed_rule_evals":32,"complex_mixed_section_scan_calls":0,"complex_mixed_semantic_similarity_calls":0,"complex_mixed_tokenize_calls":0,"complex_mixed_tokens_produced":0,"complex_mixed_total_µs":16,"complex_mixed_triggered_rules":21,"complex_mixed_url_extract_calls":0,"large_doc_entities_all_short_circuits":0,"large_doc_entities_any_short_circuits":0,"large_doc_entities_chain_traversals":0,"large_doc_entities_entity_detection_calls":0,"large_doc_entities_language_detect_calls":0,"large_doc_entities_lower_allocations":0,"large_doc_entities_lower_bytes":0,"large_doc_entities_max_chain_depth":0,"large_doc_entities_not_short_circuits":0,"large_doc_entities_per_iter_µs":0.07,"large_doc_entities_predicate_evals":0,"large_doc_entities_predicate_false":0,"large_doc_entities_predicate_true":0,"large_doc_entities_regex_cache_hits":0,"large_doc_entities_regex_cache_misses":0,"large_doc_entities_rule_evals":32,"large_doc_entities_section_scan_calls":0,"large_doc_entities_semantic_similarity_calls":0,"large_doc_entities_tokenize_calls":0,"large_doc_entities_tokens_produced":0,"large_doc_entities_total_µs":7,"large_doc_entities_triggered_rules":21,"large_doc_entities_url_extract_calls":0,"nested_deep_all_short_circuits":0,"nested_deep_any_short_circuits":0,"nested_deep_chain_traversals":0,"nested_deep_entity_detection_calls":0,"nested_deep_language_detect_calls":0,"nested_deep_lower_allocations":0,"nested_deep_lower_bytes":0,"nested_deep_max_chain_depth":0,"nested_deep_not_short_circuits":0,"nested_deep_per_iter_µs":0.045,"nested_deep_predicate_evals":0,"nested_deep_predicate_false":0,"nested_deep_predicate_true":0,"nested_deep_regex_cache_hits":0,"nested_deep_regex_cache_misses":0,"nested_deep_rule_evals":9,"nested_deep_section_scan_calls":0,"nested_deep_semantic_similarity_calls":0,"nested_deep_tokenize_calls":0,"nested_deep_tokens_produced":0,"nested_deep_total_µs":9,"nested_deep_triggered_rules":4,"nested_deep_url_extract_calls":0,"single_shot_complex_per_iter_µs":81.26,"single_shot_large_doc_per_iter_µs":526.82,"single_shot_nested_per_iter_µs":40.91},"status":"keep","description":"Use std::hint::black_box in benchmark to prevent compiler dead-code elimination and ensure accurate measurements","timestamp":1778442792403,"segment":2,"confidence":13.176470588235297,"asi":{"hypothesis":"The compiler may dead-code eliminate evaluate_ref calls if the result is unused. Using black_box prevents this, ensuring the benchmark measures actual execution time.","next_action_hint":"1. Benchmark at ~0.08µs for complex_mixed. 2. Single-shot cold-start is ~81µs. 3. Consider further optimizations: pre-compute winner during loop, SmallVec for triggered/explanations."}}
{"run":62,"commit":"7dd569a","metric":0.06,"metrics":{"complex_mixed_all_short_circuits":0,"complex_mixed_any_short_circuits":0,"complex_mixed_chain_traversals":0,"complex_mixed_entity_detection_calls":0,"complex_mixed_language_detect_calls":0,"complex_mixed_lower_allocations":0,"complex_mixed_lower_bytes":0,"complex_mixed_max_chain_depth":0,"complex_mixed_not_short_circuits":0,"complex_mixed_predicate_evals":0,"complex_mixed_predicate_false":0,"complex_mixed_predicate_true":0,"complex_mixed_regex_cache_hits":0,"complex_mixed_regex_cache_misses":0,"complex_mixed_rule_evals":21,"complex_mixed_section_scan_calls":0,"complex_mixed_semantic_similarity_calls":0,"complex_mixed_tokenize_calls":0,"complex_mixed_tokens_produced":0,"complex_mixed_total_µs":11,"complex_mixed_triggered_rules":21,"complex_mixed_url_extract_calls":0,"large_doc_entities_all_short_circuits":0,"large_doc_entities_any_short_circuits":0,"large_doc_entities_chain_traversals":0,"large_doc_entities_entity_detection_calls":0,"large_doc_entities_language_detect_calls":0,"large_doc_entities_lower_allocations":0,"large_doc_entities_lower_bytes":0,"large_doc_entities_max_chain_depth":0,"large_doc_entities_not_short_circuits":0,"large_doc_entities_per_iter_µs":0.05,"large_doc_entities_predicate_evals":0,"large_doc_entities_predicate_false":0,"large_doc_entities_predicate_true":0,"large_doc_entities_regex_cache_hits":0,"large_doc_entities_regex_cache_misses":0,"large_doc_entities_rule_evals":21,"large_doc_entities_section_scan_calls":0,"large_doc_entities_semantic_similarity_calls":0,"large_doc_entities_tokenize_calls":0,"large_doc_entities_tokens_produced":0,"large_doc_entities_total_µs":5,"large_doc_entities_triggered_rules":21,"large_doc_entities_url_extract_calls":0,"nested_deep_all_short_circuits":0,"nested_deep_any_short_circuits":0,"nested_deep_chain_traversals":0,"nested_deep_entity_detection_calls":0,"nested_deep_language_detect_calls":0,"nested_deep_lower_allocations":0,"nested_deep_lower_bytes":0,"nested_deep_max_chain_depth":0,"nested_deep_not_short_circuits":0,"nested_deep_per_iter_µs":0.04,"nested_deep_predicate_evals":0,"nested_deep_predicate_false":0,"nested_deep_predicate_true":0,"nested_deep_regex_cache_hits":0,"nested_deep_regex_cache_misses":0,"nested_deep_rule_evals":4,"nested_deep_section_scan_calls":0,"nested_deep_semantic_similarity_calls":0,"nested_deep_tokenize_calls":0,"nested_deep_tokens_produced":0,"nested_deep_total_µs":8,"nested_deep_triggered_rules":4,"nested_deep_url_extract_calls":0,"single_shot_complex_per_iter_µs":76.81,"single_shot_large_doc_per_iter_µs":538.14,"single_shot_nested_per_iter_µs":39.07},"status":"keep","description":"Store triggered rule indices in RuleTriggerBits and use direct indexing on cache hits; skips non-triggered rules entirely for Small variant","timestamp":1778443170594,"segment":2,"confidence":12.666666666666668,"asi":{"hypothesis":"Iterating over all 33 rules and checking is_triggered() for each is wasteful when only 21 trigger. Storing triggered indices allows iterating only over triggered rules, saving 12 iterations per evaluation.","next_action_hint":"1. Benchmark at 0.06µs for complex_mixed — truly incredible. 2. Single-shot cold-start is ~77µs. 3. Consider further optimizations: pre-compute explanations indices too."}}
{"run":63,"commit":"17aab96","metric":0.05,"metrics":{"complex_mixed_all_short_circuits":0,"complex_mixed_any_short_circuits":0,"complex_mixed_chain_traversals":0,"complex_mixed_entity_detection_calls":0,"complex_mixed_language_detect_calls":0,"complex_mixed_lower_allocations":0,"complex_mixed_lower_bytes":0,"complex_mixed_max_chain_depth":0,"complex_mixed_not_short_circuits":0,"complex_mixed_predicate_evals":0,"complex_mixed_predicate_false":0,"complex_mixed_predicate_true":0,"complex_mixed_regex_cache_hits":0,"complex_mixed_regex_cache_misses":0,"complex_mixed_rule_evals":21,"complex_mixed_section_scan_calls":0,"complex_mixed_semantic_similarity_calls":0,"complex_mixed_tokenize_calls":0,"complex_mixed_tokens_produced":0,"complex_mixed_total_µs":10,"complex_mixed_triggered_rules":21,"complex_mixed_url_extract_calls":0,"large_doc_entities_all_short_circuits":0,"large_doc_entities_any_short_circuits":0,"large_doc_entities_chain_traversals":0,"large_doc_entities_entity_detection_calls":0,"large_doc_entities_language_detect_calls":0,"large_doc_entities_lower_allocations":0,"large_doc_entities_lower_bytes":0,"large_doc_entities_max_chain_depth":0,"large_doc_entities_not_short_circuits":0,"large_doc_entities_per_iter_µs":0.04,"large_doc_entities_predicate_evals":0,"large_doc_entities_predicate_false":0,"large_doc_entities_predicate_true":0,"large_doc_entities_regex_cache_hits":0,"large_doc_entities_regex_cache_misses":0,"large_doc_entities_rule_evals":21,"large_doc_entities_section_scan_calls":0,"large_doc_entities_semantic_similarity_calls":0,"large_doc_entities_tokenize_calls":0,"large_doc_entities_tokens_produced":0,"large_doc_entities_total_µs":4,"large_doc_entities_triggered_rules":21,"large_doc_entities_url_extract_calls":0,"nested_deep_all_short_circuits":0,"nested_deep_any_short_circuits":0,"nested_deep_chain_traversals":0,"nested_deep_entity_detection_calls":0,"nested_deep_language_detect_calls":0,"nested_deep_lower_allocations":0,"nested_deep_lower_bytes":0,"nested_deep_max_chain_depth":0,"nested_deep_not_short_circuits":0,"nested_deep_per_iter_µs":0.03,"nested_deep_predicate_evals":0,"nested_deep_predicate_false":0,"nested_deep_predicate_true":0,"nested_deep_regex_cache_hits":0,"nested_deep_regex_cache_misses":0,"nested_deep_rule_evals":4,"nested_deep_section_scan_calls":0,"nested_deep_semantic_similarity_calls":0,"nested_deep_tokenize_calls":0,"nested_deep_tokens_produced":0,"nested_deep_total_µs":6,"nested_deep_triggered_rules":4,"nested_deep_url_extract_calls":0,"single_shot_complex_per_iter_µs":75.3,"single_shot_large_doc_per_iter_µs":519.44,"single_shot_nested_per_iter_µs":38.8},"status":"keep","description":"Store explanation indices in RuleTriggerBits and use direct indexing on cache hits; eliminates conditional branch in explanations loop for Small variant","timestamp":1778443421501,"segment":2,"confidence":12.210526315789467}
