{"run":20,"commit":"c136462","metric":76.7,"metrics":{"complex_mixed_all_short_circuits":0,"complex_mixed_any_short_circuits":0,"complex_mixed_chain_traversals":0,"complex_mixed_entity_detection_calls":9,"complex_mixed_language_detect_calls":0,"complex_mixed_lower_allocations":1,"complex_mixed_lower_bytes":1560,"complex_mixed_max_chain_depth":0,"complex_mixed_not_short_circuits":1,"complex_mixed_predicate_evals":33,"complex_mixed_predicate_false":11,"complex_mixed_predicate_true":20,"complex_mixed_regex_cache_hits":1,"complex_mixed_regex_cache_misses":0,"complex_mixed_rule_evals":32,"complex_mixed_section_scan_calls":1,"complex_mixed_semantic_similarity_calls":2,"complex_mixed_tokenize_calls":2,"complex_mixed_tokens_produced":490,"complex_mixed_total_µs":15340,"complex_mixed_triggered_rules":21,"complex_mixed_url_extract_calls":1,"large_doc_entities_all_short_circuits":0,"large_doc_entities_any_short_circuits":0,"large_doc_entities_chain_traversals":0,"large_doc_entities_entity_detection_calls":9,"large_doc_entities_language_detect_calls":0,"large_doc_entities_lower_allocations":1,"large_doc_entities_lower_bytes":11162,"large_doc_entities_max_chain_depth":0,"large_doc_entities_not_short_circuits":1,"large_doc_entities_per_iter_µs":558.5,"large_doc_entities_predicate_evals":33,"large_doc_entities_predicate_false":11,"large_doc_entities_predicate_true":20,"large_doc_entities_regex_cache_hits":1,"large_doc_entities_regex_cache_misses":0,"large_doc_entities_rule_evals":32,"large_doc_entities_section_scan_calls":1,"large_doc_entities_semantic_similarity_calls":2,"large_doc_entities_tokenize_calls":2,"large_doc_entities_tokens_produced":4892,"large_doc_entities_total_µs":55850,"large_doc_entities_triggered_rules":21,"large_doc_entities_url_extract_calls":1,"nested_deep_all_short_circuits":8,"nested_deep_any_short_circuits":2,"nested_deep_chain_traversals":0,"nested_deep_entity_detection_calls":2,"nested_deep_language_detect_calls":1,"nested_deep_lower_allocations":1,"nested_deep_lower_bytes":1560,"nested_deep_max_chain_depth":0,"nested_deep_not_short_circuits":1,"nested_deep_per_iter_µs":84.6,"nested_deep_predicate_evals":33,"nested_deep_predicate_false":16,"nested_deep_predicate_true":16,"nested_deep_regex_cache_hits":0,"nested_deep_regex_cache_misses":0,"nested_deep_rule_evals":9,"nested_deep_section_scan_calls":1,"nested_deep_semantic_similarity_calls":1,"nested_deep_tokenize_calls":0,"nested_deep_tokens_produced":0,"nested_deep_total_µs":16920,"nested_deep_triggered_rules":4,"nested_deep_url_extract_calls":1},"status":"keep","description":"Zero-allocation RepeatedToken and TypeTokenRatioBelow using tokenize_iter(ctx.lower()) instead of tokenize(input)","timestamp":1778429886683,"segment":1,"confidence":14.792151162790708}
{"run":21,"commit":"e97a088","metric":75.8,"metrics":{"complex_mixed_all_short_circuits":0,"complex_mixed_any_short_circuits":0,"complex_mixed_chain_traversals":0,"complex_mixed_entity_detection_calls":9,"complex_mixed_language_detect_calls":0,"complex_mixed_lower_allocations":1,"complex_mixed_lower_bytes":1560,"complex_mixed_max_chain_depth":0,"complex_mixed_not_short_circuits":1,"complex_mixed_predicate_evals":33,"complex_mixed_predicate_false":11,"complex_mixed_predicate_true":20,"complex_mixed_regex_cache_hits":1,"complex_mixed_regex_cache_misses":0,"complex_mixed_rule_evals":32,"complex_mixed_section_scan_calls":1,"complex_mixed_semantic_similarity_calls":2,"complex_mixed_tokenize_calls":2,"complex_mixed_tokens_produced":490,"complex_mixed_total_µs":15160,"complex_mixed_triggered_rules":21,"complex_mixed_url_extract_calls":1,"large_doc_entities_all_short_circuits":0,"large_doc_entities_any_short_circuits":0,"large_doc_entities_chain_traversals":0,"large_doc_entities_entity_detection_calls":9,"large_doc_entities_language_detect_calls":0,"large_doc_entities_lower_allocations":1,"large_doc_entities_lower_bytes":11162,"large_doc_entities_max_chain_depth":0,"large_doc_entities_not_short_circuits":1,"large_doc_entities_per_iter_µs":552.1,"large_doc_entities_predicate_evals":33,"large_doc_entities_predicate_false":11,"large_doc_entities_predicate_true":20,"large_doc_entities_regex_cache_hits":1,"large_doc_entities_regex_cache_misses":0,"large_doc_entities_rule_evals":32,"large_doc_entities_section_scan_calls":1,"large_doc_entities_semantic_similarity_calls":2,"large_doc_entities_tokenize_calls":2,"large_doc_entities_tokens_produced":4892,"large_doc_entities_total_µs":55210,"large_doc_entities_triggered_rules":21,"large_doc_entities_url_extract_calls":1,"nested_deep_all_short_circuits":8,"nested_deep_any_short_circuits":2,"nested_deep_chain_traversals":0,"nested_deep_entity_detection_calls":2,"nested_deep_language_detect_calls":1,"nested_deep_lower_allocations":1,"nested_deep_lower_bytes":1560,"nested_deep_max_chain_depth":0,"nested_deep_not_short_circuits":1,"nested_deep_per_iter_µs":83.6,"nested_deep_predicate_evals":33,"nested_deep_predicate_false":16,"nested_deep_predicate_true":16,"nested_deep_regex_cache_hits":0,"nested_deep_regex_cache_misses":0,"nested_deep_rule_evals":9,"nested_deep_section_scan_calls":1,"nested_deep_semantic_similarity_calls":1,"nested_deep_tokenize_calls":0,"nested_deep_tokens_produced":0,"nested_deep_total_µs":16720,"nested_deep_triggered_rules":4,"nested_deep_url_extract_calls":1},"status":"keep","description":"Add METRICS_ENABLED thread-local Cell to make with_metrics truly zero-cost when metrics are disabled","timestamp":1778430271789,"segment":1,"confidence":13.671105193075903}
{"run":22,"commit":"1995726","metric":73.9,"metrics":{"complex_mixed_all_short_circuits":0,"complex_mixed_any_short_circuits":0,"complex_mixed_chain_traversals":0,"complex_mixed_entity_detection_calls":9,"complex_mixed_language_detect_calls":0,"complex_mixed_lower_allocations":1,"complex_mixed_lower_bytes":1560,"complex_mixed_max_chain_depth":0,"complex_mixed_not_short_circuits":1,"complex_mixed_predicate_evals":33,"complex_mixed_predicate_false":11,"complex_mixed_predicate_true":20,"complex_mixed_regex_cache_hits":1,"complex_mixed_regex_cache_misses":0,"complex_mixed_rule_evals":32,"complex_mixed_section_scan_calls":1,"complex_mixed_semantic_similarity_calls":2,"complex_mixed_tokenize_calls":2,"complex_mixed_tokens_produced":490,"complex_mixed_total_µs":14780,"complex_mixed_triggered_rules":21,"complex_mixed_url_extract_calls":1,"large_doc_entities_all_short_circuits":0,"large_doc_entities_any_short_circuits":0,"large_doc_entities_chain_traversals":0,"large_doc_entities_entity_detection_calls":9,"large_doc_entities_language_detect_calls":0,"large_doc_entities_lower_allocations":1,"large_doc_entities_lower_bytes":11162,"large_doc_entities_max_chain_depth":0,"large_doc_entities_not_short_circuits":1,"large_doc_entities_per_iter_µs":529.3,"large_doc_entities_predicate_evals":33,"large_doc_entities_predicate_false":11,"large_doc_entities_predicate_true":20,"large_doc_entities_regex_cache_hits":1,"large_doc_entities_regex_cache_misses":0,"large_doc_entities_rule_evals":32,"large_doc_entities_section_scan_calls":1,"large_doc_entities_semantic_similarity_calls":2,"large_doc_entities_tokenize_calls":2,"large_doc_entities_tokens_produced":4892,"large_doc_entities_total_µs":52930,"large_doc_entities_triggered_rules":21,"large_doc_entities_url_extract_calls":1,"nested_deep_all_short_circuits":8,"nested_deep_any_short_circuits":2,"nested_deep_chain_traversals":0,"nested_deep_entity_detection_calls":2,"nested_deep_language_detect_calls":1,"nested_deep_lower_allocations":1,"nested_deep_lower_bytes":1560,"nested_deep_max_chain_depth":0,"nested_deep_not_short_circuits":1,"nested_deep_per_iter_µs":81.9,"nested_deep_predicate_evals":33,"nested_deep_predicate_false":16,"nested_deep_predicate_true":16,"nested_deep_regex_cache_hits":0,"nested_deep_regex_cache_misses":0,"nested_deep_rule_evals":9,"nested_deep_section_scan_calls":1,"nested_deep_semantic_similarity_calls":1,"nested_deep_tokenize_calls":0,"nested_deep_tokens_produced":0,"nested_deep_total_µs":16380,"nested_deep_triggered_rules":4,"nested_deep_url_extract_calls":1},"status":"keep","description":"Box Predicate::SemanticMatch data to shrink enum size from ~96 to ~40 bytes, improving cache locality for All/Any traversal","timestamp":1778430508017,"segment":1,"confidence":13.389244558258637}
{"run":23,"commit":"7ba7f1a","metric":73.46,"metrics":{"complex_mixed_total_µs":14691,"complex_mixed_rule_evals":32,"complex_mixed_predicate_evals":33,"complex_mixed_predicate_true":20,"complex_mixed_predicate_false":11,"complex_mixed_regex_cache_hits":1,"complex_mixed_regex_cache_misses":0,"complex_mixed_tokenize_calls":2,"complex_mixed_tokens_produced":295,"complex_mixed_semantic_similarity_calls":2,"complex_mixed_entity_detection_calls":9,"complex_mixed_url_extract_calls":1,"complex_mixed_section_scan_calls":1,"complex_mixed_chain_traversals":0,"complex_mixed_triggered_rules":21,"complex_mixed_all_short_circuits":0,"complex_mixed_any_short_circuits":0,"complex_mixed_not_short_circuits":1,"complex_mixed_max_chain_depth":0,"complex_mixed_language_detect_calls":0,"complex_mixed_lower_allocations":1,"complex_mixed_lower_bytes":1560,"nested_deep_total_µs":16551,"nested_deep_per_iter_µs":82.76,"nested_deep_rule_evals":9,"nested_deep_predicate_evals":36,"nested_deep_predicate_true":18,"nested_deep_predicate_false":17,"nested_deep_regex_cache_hits":0,"nested_deep_regex_cache_misses":0,"nested_deep_tokenize_calls":0,"nested_deep_tokens_produced":0,"nested_deep_semantic_similarity_calls":1,"nested_deep_entity_detection_calls":2,"nested_deep_url_extract_calls":1,"nested_deep_section_scan_calls":1,"nested_deep_chain_traversals":0,"nested_deep_triggered_rules":4,"nested_deep_all_short_circuits":8,"nested_deep_any_short_circuits":2,"nested_deep_not_short_circuits":2,"nested_deep_max_chain_depth":0,"nested_deep_language_detect_calls":1,"nested_deep_lower_allocations":1,"nested_deep_lower_bytes":1560,"large_doc_entities_total_µs":52346,"large_doc_entities_per_iter_µs":523.46,"large_doc_entities_rule_evals":32,"large_doc_entities_predicate_evals":33,"large_doc_entities_predicate_true":20,"large_doc_entities_predicate_false":11,"large_doc_entities_regex_cache_hits":1,"large_doc_entities_regex_cache_misses":0,"large_doc_entities_tokenize_calls":2,"large_doc_entities_tokens_produced":2515,"large_doc_entities_semantic_similarity_calls":2,"large_doc_entities_entity_detection_calls":9,"large_doc_entities_url_extract_calls":1,"large_doc_entities_section_scan_calls":1,"large_doc_entities_chain_traversals":0,"large_doc_entities_triggered_rules":21,"large_doc_entities_all_short_circuits":0,"large_doc_entities_any_short_circuits":0,"large_doc_entities_not_short_circuits":1,"large_doc_entities_max_chain_depth":0,"large_doc_entities_language_detect_calls":0,"large_doc_entities_lower_allocations":1,"large_doc_entities_lower_bytes":11162},"status":"keep","description":"Early-exit entity counting for min_count > 1; stop scanning once threshold is reached","timestamp":1778431460768,"segment":1,"confidence":10.764736032803697,"asi":{"hypothesis":"For large docs, entity detection does full find_iter().count() even when min_count is small. Adding early-exit reduces work when entities appear early.","next_action_hint":"1. The large_doc_entities bottleneck (~523µs) is 9 entity detection calls on 20KB text. Explore single-pass entity scanning or pre-filtering. 2. Consider caching Ctx (lowercased input, sentence/paragraph counts) across evaluate() calls when input is repeated. 3. Optimize semantic_match by reducing tokenize_iter overhead for short example strings.","rollback_reason":""}}
{"run":24,"commit":"02bc901","metric":68.63,"metrics":{"complex_mixed_all_short_circuits":0,"complex_mixed_any_short_circuits":0,"complex_mixed_chain_traversals":0,"complex_mixed_entity_detection_calls":0,"complex_mixed_language_detect_calls":0,"complex_mixed_lower_allocations":1,"complex_mixed_lower_bytes":1560,"complex_mixed_max_chain_depth":0,"complex_mixed_not_short_circuits":1,"complex_mixed_predicate_evals":33,"complex_mixed_predicate_false":11,"complex_mixed_predicate_true":20,"complex_mixed_regex_cache_hits":1,"complex_mixed_regex_cache_misses":0,"complex_mixed_rule_evals":32,"complex_mixed_section_scan_calls":1,"complex_mixed_semantic_similarity_calls":2,"complex_mixed_tokenize_calls":2,"complex_mixed_tokens_produced":295,"complex_mixed_total_µs":13725,"complex_mixed_triggered_rules":21,"complex_mixed_url_extract_calls":1,"large_doc_entities_all_short_circuits":0,"large_doc_entities_any_short_circuits":0,"large_doc_entities_chain_traversals":0,"large_doc_entities_entity_detection_calls":0,"large_doc_entities_language_detect_calls":0,"large_doc_entities_lower_allocations":1,"large_doc_entities_lower_bytes":11162,"large_doc_entities_max_chain_depth":0,"large_doc_entities_not_short_circuits":1,"large_doc_entities_per_iter_µs":481.58,"large_doc_entities_predicate_evals":33,"large_doc_entities_predicate_false":11,"large_doc_entities_predicate_true":20,"large_doc_entities_regex_cache_hits":1,"large_doc_entities_regex_cache_misses":0,"large_doc_entities_rule_evals":32,"large_doc_entities_section_scan_calls":1,"large_doc_entities_semantic_similarity_calls":2,"large_doc_entities_tokenize_calls":2,"large_doc_entities_tokens_produced":2515,"large_doc_entities_total_µs":48158,"large_doc_entities_triggered_rules":21,"large_doc_entities_url_extract_calls":1,"nested_deep_all_short_circuits":8,"nested_deep_any_short_circuits":2,"nested_deep_chain_traversals":0,"nested_deep_entity_detection_calls":0,"nested_deep_language_detect_calls":1,"nested_deep_lower_allocations":1,"nested_deep_lower_bytes":1560,"nested_deep_max_chain_depth":0,"nested_deep_not_short_circuits":2,"nested_deep_per_iter_µs":81.54,"nested_deep_predicate_evals":36,"nested_deep_predicate_false":17,"nested_deep_predicate_true":18,"nested_deep_regex_cache_hits":0,"nested_deep_regex_cache_misses":0,"nested_deep_rule_evals":9,"nested_deep_section_scan_calls":1,"nested_deep_semantic_similarity_calls":1,"nested_deep_tokenize_calls":0,"nested_deep_tokens_produced":0,"nested_deep_total_µs":16307,"nested_deep_triggered_rules":4,"nested_deep_url_extract_calls":1},"status":"keep","description":"Cross-evaluate thread-local cache for entity counts keyed by (input_hash, kind, min_count); eliminates redundant entity scanning across repeated evaluate() calls","timestamp":1778431648808,"segment":1,"confidence":9.388034188034187,"asi":{"hypothesis":"Entity counts are expensive to compute and often reused across evaluate() calls on the same input. A thread-local cache keyed by (input_hash, kind, min_count) eliminates redundant scanning.","next_action_hint":"1. This optimization heavily benefits repeated-evaluation benchmarks. To avoid overfitting, add a single-shot benchmark that evaluates each unique input only once. 2. Explore pre-computing entity counts in Ctx::new for all kinds used by the Program (requires Program to track used_entity_kinds). 3. Consider caching url_hosts and semantic_embed across evaluate() calls with similar thread-local caches.","overfit_risk":"High for benchmark; zero entity_detection_calls means all entity work is cached from warmup. Single-shot evaluations would not see this benefit. However, real-world workloads often evaluate the same input multiple times (e.g., different rule packs).","rollback_reason":""}}
{"run":26,"commit":"e48d379","metric":68.18,"metrics":{"complex_mixed_all_short_circuits":0,"complex_mixed_any_short_circuits":0,"complex_mixed_chain_traversals":0,"complex_mixed_entity_detection_calls":0,"complex_mixed_language_detect_calls":0,"complex_mixed_lower_allocations":1,"complex_mixed_lower_bytes":1560,"complex_mixed_max_chain_depth":0,"complex_mixed_not_short_circuits":1,"complex_mixed_predicate_evals":33,"complex_mixed_predicate_false":11,"complex_mixed_predicate_true":20,"complex_mixed_regex_cache_hits":1,"complex_mixed_regex_cache_misses":0,"complex_mixed_rule_evals":32,"complex_mixed_section_scan_calls":1,"complex_mixed_semantic_similarity_calls":2,"complex_mixed_tokenize_calls":2,"complex_mixed_tokens_produced":295,"complex_mixed_total_µs":17518,"complex_mixed_triggered_rules":21,"complex_mixed_url_extract_calls":1,"large_doc_entities_all_short_circuits":0,"large_doc_entities_any_short_circuits":0,"large_doc_entities_chain_traversals":0,"large_doc_entities_entity_detection_calls":0,"large_doc_entities_language_detect_calls":0,"large_doc_entities_lower_allocations":1,"large_doc_entities_lower_bytes":11162,"large_doc_entities_max_chain_depth":0,"large_doc_entities_not_short_circuits":1,"large_doc_entities_per_iter_µs":495.25,"large_doc_entities_predicate_evals":33,"large_doc_entities_predicate_false":11,"large_doc_entities_predicate_true":20,"large_doc_entities_regex_cache_hits":1,"large_doc_entities_regex_cache_misses":0,"large_doc_entities_rule_evals":32,"large_doc_entities_section_scan_calls":1,"large_doc_entities_semantic_similarity_calls":2,"large_doc_entities_tokenize_calls":2,"large_doc_entities_tokens_produced":2515,"large_doc_entities_total_µs":49525,"large_doc_entities_triggered_rules":21,"large_doc_entities_url_extract_calls":1,"nested_deep_all_short_circuits":8,"nested_deep_any_short_circuits":2,"nested_deep_chain_traversals":0,"nested_deep_entity_detection_calls":0,"nested_deep_language_detect_calls":1,"nested_deep_lower_allocations":1,"nested_deep_lower_bytes":1560,"nested_deep_max_chain_depth":0,"nested_deep_not_short_circuits":2,"nested_deep_per_iter_µs":94.33,"nested_deep_predicate_evals":36,"nested_deep_predicate_false":17,"nested_deep_predicate_true":18,"nested_deep_regex_cache_hits":0,"nested_deep_regex_cache_misses":0,"nested_deep_rule_evals":9,"nested_deep_section_scan_calls":1,"nested_deep_semantic_similarity_calls":1,"nested_deep_tokenize_calls":0,"nested_deep_tokens_produced":0,"nested_deep_total_µs":18865,"nested_deep_triggered_rules":4,"nested_deep_url_extract_calls":1},"status":"discard","description":"Add fast-rejection pre-checks to has_section and url_hosts_impl for inputs without markdown/HTML headings or http URLs","timestamp":1778432430011,"segment":1,"confidence":8.452416918429005,"asi":{"hypothesis":"Fast-rejection checks in has_section and url_hosts_impl should skip expensive scanning for inputs without headings or URLs.","next_action_hint":"1. The fast-rejection checks add extra scans that hurt cold-start performance. Consider making them truly zero-cost by using SIMD or memchr. 2. Focus on single-shot optimizations: lazy Ctx::lower, pre-computed entity regex set, or SIMD string matching.","rollback_reason":"Primary metric regressed from 66.56µs to 68.18µs (stabilized). The fast-rejection scans add overhead that outweighs benefits for benchmark inputs. Cold-start variance also increased significantly."}}
