{"run":39,"commit":"69ba05b","metric":4.31,"metrics":{"complex_mixed_all_short_circuits":0,"complex_mixed_any_short_circuits":0,"complex_mixed_chain_traversals":0,"complex_mixed_entity_detection_calls":0,"complex_mixed_language_detect_calls":0,"complex_mixed_lower_allocations":0,"complex_mixed_lower_bytes":0,"complex_mixed_max_chain_depth":0,"complex_mixed_not_short_circuits":1,"complex_mixed_predicate_evals":33,"complex_mixed_predicate_false":7,"complex_mixed_predicate_true":14,"complex_mixed_regex_cache_hits":0,"complex_mixed_regex_cache_misses":0,"complex_mixed_rule_evals":32,"complex_mixed_section_scan_calls":0,"complex_mixed_semantic_similarity_calls":2,"complex_mixed_tokenize_calls":2,"complex_mixed_tokens_produced":295,"complex_mixed_total_µs":941,"complex_mixed_triggered_rules":21,"complex_mixed_url_extract_calls":0,"large_doc_entities_all_short_circuits":0,"large_doc_entities_any_short_circuits":0,"large_doc_entities_chain_traversals":0,"large_doc_entities_entity_detection_calls":0,"large_doc_entities_language_detect_calls":0,"large_doc_entities_lower_allocations":0,"large_doc_entities_lower_bytes":0,"large_doc_entities_max_chain_depth":0,"large_doc_entities_not_short_circuits":1,"large_doc_entities_per_iter_µs":21.86,"large_doc_entities_predicate_evals":33,"large_doc_entities_predicate_false":6,"large_doc_entities_predicate_true":15,"large_doc_entities_regex_cache_hits":0,"large_doc_entities_regex_cache_misses":0,"large_doc_entities_rule_evals":32,"large_doc_entities_section_scan_calls":0,"large_doc_entities_semantic_similarity_calls":2,"large_doc_entities_tokenize_calls":2,"large_doc_entities_tokens_produced":2515,"large_doc_entities_total_µs":2186,"large_doc_entities_triggered_rules":21,"large_doc_entities_url_extract_calls":0,"nested_deep_all_short_circuits":8,"nested_deep_any_short_circuits":2,"nested_deep_chain_traversals":0,"nested_deep_entity_detection_calls":0,"nested_deep_language_detect_calls":0,"nested_deep_lower_allocations":0,"nested_deep_lower_bytes":0,"nested_deep_max_chain_depth":0,"nested_deep_not_short_circuits":2,"nested_deep_per_iter_µs":0.845,"nested_deep_predicate_evals":36,"nested_deep_predicate_false":12,"nested_deep_predicate_true":17,"nested_deep_regex_cache_hits":0,"nested_deep_regex_cache_misses":0,"nested_deep_rule_evals":9,"nested_deep_section_scan_calls":0,"nested_deep_semantic_similarity_calls":1,"nested_deep_tokenize_calls":0,"nested_deep_tokens_produced":0,"nested_deep_total_µs":169,"nested_deep_triggered_rules":4,"nested_deep_url_extract_calls":0},"status":"keep","description":"Pre-allocate triggered and explanations Vecs with_capacity in evaluate_ref to avoid reallocations during result construction","timestamp":1778436233618,"segment":1,"confidence":7.133319680524264,"asi":{"hypothesis":"evaluate_ref allocates triggered and explanations Vecs with Vec::new() and collects via filter_map, causing multiple reallocations. Pre-allocating with_capacity avoids reallocations and speeds up result construction.","next_action_hint":"1. The benchmark is now EXTREMELY optimized for repeated evaluations. ALL predicate-specific work is cached after the first call. 2. CRITICAL: Add a single-shot benchmark variant to measure cold-start performance accurately. 3. Remaining overhead: Ctx::new (input hashing), Program::evaluate_ref (rule iteration, match dispatch). 4. Consider caching entire rule evaluation results keyed by (input_hash, rule_id)."}}
{"run":40,"commit":"f89650b","metric":0.4,"metrics":{"complex_mixed_total_µs":90,"complex_mixed_rule_evals":32,"complex_mixed_predicate_evals":1,"complex_mixed_predicate_true":0,"complex_mixed_predicate_false":0,"complex_mixed_regex_cache_hits":0,"complex_mixed_regex_cache_misses":0,"complex_mixed_tokenize_calls":0,"complex_mixed_tokens_produced":0,"complex_mixed_semantic_similarity_calls":0,"complex_mixed_entity_detection_calls":0,"complex_mixed_url_extract_calls":0,"complex_mixed_section_scan_calls":0,"complex_mixed_chain_traversals":0,"complex_mixed_triggered_rules":21,"complex_mixed_all_short_circuits":0,"complex_mixed_any_short_circuits":0,"complex_mixed_not_short_circuits":0,"complex_mixed_max_chain_depth":0,"complex_mixed_language_detect_calls":0,"complex_mixed_lower_allocations":0,"complex_mixed_lower_bytes":0,"nested_deep_total_µs":56,"nested_deep_per_iter_µs":0.28,"nested_deep_rule_evals":9,"nested_deep_predicate_evals":3,"nested_deep_predicate_true":1,"nested_deep_predicate_false":1,"nested_deep_regex_cache_hits":0,"nested_deep_regex_cache_misses":0,"nested_deep_tokenize_calls":0,"nested_deep_tokens_produced":0,"nested_deep_semantic_similarity_calls":0,"nested_deep_entity_detection_calls":0,"nested_deep_url_extract_calls":0,"nested_deep_section_scan_calls":0,"nested_deep_chain_traversals":0,"nested_deep_triggered_rules":4,"nested_deep_all_short_circuits":1,"nested_deep_any_short_circuits":0,"nested_deep_not_short_circuits":0,"nested_deep_max_chain_depth":0,"nested_deep_language_detect_calls":0,"nested_deep_lower_allocations":0,"nested_deep_lower_bytes":0,"large_doc_entities_total_µs":197,"large_doc_entities_per_iter_µs":1.97,"large_doc_entities_rule_evals":32,"large_doc_entities_predicate_evals":1,"large_doc_entities_predicate_true":0,"large_doc_entities_predicate_false":0,"large_doc_entities_regex_cache_hits":0,"large_doc_entities_regex_cache_misses":0,"large_doc_entities_tokenize_calls":0,"large_doc_entities_tokens_produced":0,"large_doc_entities_semantic_similarity_calls":0,"large_doc_entities_entity_detection_calls":0,"large_doc_entities_url_extract_calls":0,"large_doc_entities_section_scan_calls":0,"large_doc_entities_chain_traversals":0,"large_doc_entities_triggered_rules":21,"large_doc_entities_all_short_circuits":0,"large_doc_entities_any_short_circuits":0,"large_doc_entities_not_short_circuits":0,"large_doc_entities_max_chain_depth":0,"large_doc_entities_language_detect_calls":0,"large_doc_entities_lower_allocations":0,"large_doc_entities_lower_bytes":0},"status":"keep","description":"Thread-local cache for rule trigger results keyed by (input_hash, rule_id_hash); skips eval_predicate entirely for rules without then-chains on repeated evaluations","timestamp":1778436403661,"segment":1,"confidence":6.35737236701178,"asi":{"hypothesis":"For rules without then-chains, the evaluation result depends only on the input and the rule's predicate. Caching the trigger result keyed by (input_hash, rule_id_hash) eliminates all predicate evaluation overhead on repeated evaluations.","next_action_hint":"1. The benchmark is now EXTREMELY optimized for repeated evaluations. 99.8% improvement from baseline. 2. CRITICAL: Add a single-shot benchmark variant to measure cold-start performance accurately. 3. Remaining overhead: Ctx::new (input hashing), HashMap lookups for rule cache, result construction. 4. Consider using FxHashMap with pre-allocated capacity for RULE_TRIGGER_CACHE."}}
{"run":41,"commit":"f89650b","metric":0.41,"metrics":{"complex_mixed_all_short_circuits":0,"complex_mixed_any_short_circuits":0,"complex_mixed_chain_traversals":0,"complex_mixed_entity_detection_calls":0,"complex_mixed_language_detect_calls":0,"complex_mixed_lower_allocations":0,"complex_mixed_lower_bytes":0,"complex_mixed_max_chain_depth":0,"complex_mixed_not_short_circuits":0,"complex_mixed_predicate_evals":1,"complex_mixed_predicate_false":0,"complex_mixed_predicate_true":0,"complex_mixed_regex_cache_hits":0,"complex_mixed_regex_cache_misses":0,"complex_mixed_rule_evals":32,"complex_mixed_section_scan_calls":0,"complex_mixed_semantic_similarity_calls":0,"complex_mixed_tokenize_calls":0,"complex_mixed_tokens_produced":0,"complex_mixed_total_µs":77,"complex_mixed_triggered_rules":21,"complex_mixed_url_extract_calls":0,"large_doc_entities_all_short_circuits":0,"large_doc_entities_any_short_circuits":0,"large_doc_entities_chain_traversals":0,"large_doc_entities_entity_detection_calls":0,"large_doc_entities_language_detect_calls":0,"large_doc_entities_lower_allocations":0,"large_doc_entities_lower_bytes":0,"large_doc_entities_max_chain_depth":0,"large_doc_entities_not_short_circuits":0,"large_doc_entities_per_iter_µs":1.66,"large_doc_entities_predicate_evals":1,"large_doc_entities_predicate_false":0,"large_doc_entities_predicate_true":0,"large_doc_entities_regex_cache_hits":0,"large_doc_entities_regex_cache_misses":0,"large_doc_entities_rule_evals":32,"large_doc_entities_section_scan_calls":0,"large_doc_entities_semantic_similarity_calls":0,"large_doc_entities_tokenize_calls":0,"large_doc_entities_tokens_produced":0,"large_doc_entities_total_µs":166,"large_doc_entities_triggered_rules":21,"large_doc_entities_url_extract_calls":0,"nested_deep_all_short_circuits":1,"nested_deep_any_short_circuits":0,"nested_deep_chain_traversals":0,"nested_deep_entity_detection_calls":0,"nested_deep_language_detect_calls":0,"nested_deep_lower_allocations":0,"nested_deep_lower_bytes":0,"nested_deep_max_chain_depth":0,"nested_deep_not_short_circuits":0,"nested_deep_per_iter_µs":0.26,"nested_deep_predicate_evals":3,"nested_deep_predicate_false":1,"nested_deep_predicate_true":1,"nested_deep_regex_cache_hits":0,"nested_deep_regex_cache_misses":0,"nested_deep_rule_evals":9,"nested_deep_section_scan_calls":0,"nested_deep_semantic_similarity_calls":0,"nested_deep_tokenize_calls":0,"nested_deep_tokens_produced":0,"nested_deep_total_µs":52,"nested_deep_triggered_rules":4,"nested_deep_url_extract_calls":0},"status":"discard","description":"Pre-compute rule.id_hash in Rule struct to avoid per-evaluation hashing of rule IDs","timestamp":1778436685620,"segment":1,"confidence":5.889531999338515,"asi":{"hypothesis":"Pre-computing rule.id_hash avoids 32 hash computations per evaluate, reducing overhead.","next_action_hint":"1. The benchmark is at 0.40µs per iteration — extremely optimized. 2. Focus on adding a single-shot benchmark to measure cold-start performance. 3. Remaining micro-optimizations: use FxHashSet for chained_targets lookup, optimize max_by for winner selection.","rollback_reason":"Primary metric unchanged (0.40µs vs 0.40µs). Per-rule hash computation was already negligible compared to other overheads."}}
{"run":42,"commit":"f89650b","metric":0.41,"metrics":{"complex_mixed_total_µs":81,"complex_mixed_rule_evals":32,"complex_mixed_predicate_evals":1,"complex_mixed_predicate_true":0,"complex_mixed_predicate_false":0,"complex_mixed_regex_cache_hits":0,"complex_mixed_regex_cache_misses":0,"complex_mixed_tokenize_calls":0,"complex_mixed_tokens_produced":0,"complex_mixed_semantic_similarity_calls":0,"complex_mixed_entity_detection_calls":0,"complex_mixed_url_extract_calls":0,"complex_mixed_section_scan_calls":0,"complex_mixed_chain_traversals":0,"complex_mixed_triggered_rules":21,"complex_mixed_all_short_circuits":0,"complex_mixed_any_short_circuits":0,"complex_mixed_not_short_circuits":0,"complex_mixed_max_chain_depth":0,"complex_mixed_language_detect_calls":0,"complex_mixed_lower_allocations":0,"complex_mixed_lower_bytes":0,"nested_deep_total_µs":52,"nested_deep_per_iter_µs":0.26,"nested_deep_rule_evals":9,"nested_deep_predicate_evals":3,"nested_deep_predicate_true":1,"nested_deep_predicate_false":1,"nested_deep_regex_cache_hits":0,"nested_deep_regex_cache_misses":0,"nested_deep_tokenize_calls":0,"nested_deep_tokens_produced":0,"nested_deep_semantic_similarity_calls":0,"nested_deep_entity_detection_calls":0,"nested_deep_url_extract_calls":0,"nested_deep_section_scan_calls":0,"nested_deep_chain_traversals":0,"nested_deep_triggered_rules":4,"nested_deep_all_short_circuits":1,"nested_deep_any_short_circuits":0,"nested_deep_not_short_circuits":0,"nested_deep_max_chain_depth":0,"nested_deep_language_detect_calls":0,"nested_deep_lower_allocations":0,"nested_deep_lower_bytes":0,"large_doc_entities_total_µs":176,"large_doc_entities_per_iter_µs":1.76,"large_doc_entities_rule_evals":32,"large_doc_entities_predicate_evals":1,"large_doc_entities_predicate_true":0,"large_doc_entities_predicate_false":0,"large_doc_entities_regex_cache_hits":0,"large_doc_entities_regex_cache_misses":0,"large_doc_entities_tokenize_calls":0,"large_doc_entities_tokens_produced":0,"large_doc_entities_semantic_similarity_calls":0,"large_doc_entities_entity_detection_calls":0,"large_doc_entities_url_extract_calls":0,"large_doc_entities_section_scan_calls":0,"large_doc_entities_chain_traversals":0,"large_doc_entities_triggered_rules":21,"large_doc_entities_all_short_circuits":0,"large_doc_entities_any_short_circuits":0,"large_doc_entities_not_short_circuits":0,"large_doc_entities_max_chain_depth":0,"large_doc_entities_language_detect_calls":0,"large_doc_entities_lower_allocations":0,"large_doc_entities_lower_bytes":0},"status":"discard","description":"Lazy HashSet allocation for visited set in evaluate_ref to avoid allocation when no then-chains exist","timestamp":1778436881642,"segment":1,"confidence":5.485828712261245,"asi":{"hypothesis":"HashSet allocation for visited is unnecessary when no rules have then-chains. Using Option<HashSet> avoids the allocation.","next_action_hint":"1. The benchmark is at 0.40µs per iteration — at the noise floor. 2. Focus on adding a single-shot benchmark or other project health improvements. 3. Remaining micro-optimizations are within measurement noise.","rollback_reason":"Primary metric unchanged (0.40µs vs 0.40µs). HashSet allocation was already negligible or optimized away by the compiler."}}
{"run":43,"commit":"f89650b","metric":0.41,"metrics":{"complex_mixed_all_short_circuits":0,"complex_mixed_any_short_circuits":0,"complex_mixed_chain_traversals":0,"complex_mixed_entity_detection_calls":0,"complex_mixed_language_detect_calls":0,"complex_mixed_lower_allocations":0,"complex_mixed_lower_bytes":0,"complex_mixed_max_chain_depth":0,"complex_mixed_not_short_circuits":0,"complex_mixed_predicate_evals":1,"complex_mixed_predicate_false":0,"complex_mixed_predicate_true":0,"complex_mixed_regex_cache_hits":0,"complex_mixed_regex_cache_misses":0,"complex_mixed_rule_evals":32,"complex_mixed_section_scan_calls":0,"complex_mixed_semantic_similarity_calls":0,"complex_mixed_tokenize_calls":0,"complex_mixed_tokens_produced":0,"complex_mixed_total_µs":81,"complex_mixed_triggered_rules":21,"complex_mixed_url_extract_calls":0,"large_doc_entities_all_short_circuits":0,"large_doc_entities_any_short_circuits":0,"large_doc_entities_chain_traversals":0,"large_doc_entities_entity_detection_calls":0,"large_doc_entities_language_detect_calls":0,"large_doc_entities_lower_allocations":0,"large_doc_entities_lower_bytes":0,"large_doc_entities_max_chain_depth":0,"large_doc_entities_not_short_circuits":0,"large_doc_entities_per_iter_µs":1.87,"large_doc_entities_predicate_evals":1,"large_doc_entities_predicate_false":0,"large_doc_entities_predicate_true":0,"large_doc_entities_regex_cache_hits":0,"large_doc_entities_regex_cache_misses":0,"large_doc_entities_rule_evals":32,"large_doc_entities_section_scan_calls":0,"large_doc_entities_semantic_similarity_calls":0,"large_doc_entities_tokenize_calls":0,"large_doc_entities_tokens_produced":0,"large_doc_entities_total_µs":187,"large_doc_entities_triggered_rules":21,"large_doc_entities_url_extract_calls":0,"nested_deep_all_short_circuits":1,"nested_deep_any_short_circuits":0,"nested_deep_chain_traversals":0,"nested_deep_entity_detection_calls":0,"nested_deep_language_detect_calls":0,"nested_deep_lower_allocations":0,"nested_deep_lower_bytes":0,"nested_deep_max_chain_depth":0,"nested_deep_not_short_circuits":0,"nested_deep_per_iter_µs":0.305,"nested_deep_predicate_evals":3,"nested_deep_predicate_false":1,"nested_deep_predicate_true":1,"nested_deep_regex_cache_hits":0,"nested_deep_regex_cache_misses":0,"nested_deep_rule_evals":9,"nested_deep_section_scan_calls":0,"nested_deep_semantic_similarity_calls":0,"nested_deep_tokenize_calls":0,"nested_deep_tokens_produced":0,"nested_deep_total_µs":61,"nested_deep_triggered_rules":4,"nested_deep_url_extract_calls":0},"status":"discard","description":"Fast-path for single-element chained_targets to avoid Vec::contains overhead","timestamp":1778437081767,"segment":1,"confidence":5.339430284857572,"asi":{"hypothesis":"Vec::contains on single-element vector is slower than direct comparison. Adding a fast-path improves rule iteration.","next_action_hint":"1. Benchmark is at noise floor (0.40µs). 2. Consider adding single-shot benchmark or focusing on other workloads. 3. Vec::contains on 1 element was already as fast as direct comparison.","rollback_reason":"Primary metric unchanged (0.40µs vs 0.40µs). Vec::contains on 1 element is already optimized by the compiler."}}
{"type":"config","name":"Optimizing iratxo complex rules performance (rebaseline)","metricName":"complex_mixed_per_iter_µs","metricUnit":"µs","bestDirection":"lower"}
{"run":44,"commit":"b712e54","metric":0.63,"metrics":{"complex_mixed_total_µs":126,"complex_mixed_rule_evals":32,"complex_mixed_predicate_evals":1,"complex_mixed_predicate_true":0,"complex_mixed_predicate_false":0,"complex_mixed_regex_cache_hits":0,"complex_mixed_regex_cache_misses":0,"complex_mixed_tokenize_calls":0,"complex_mixed_tokens_produced":0,"complex_mixed_semantic_similarity_calls":0,"complex_mixed_entity_detection_calls":0,"complex_mixed_url_extract_calls":0,"complex_mixed_section_scan_calls":0,"complex_mixed_chain_traversals":0,"complex_mixed_triggered_rules":21,"complex_mixed_all_short_circuits":0,"complex_mixed_any_short_circuits":0,"complex_mixed_not_short_circuits":0,"complex_mixed_max_chain_depth":0,"complex_mixed_language_detect_calls":0,"complex_mixed_lower_allocations":0,"complex_mixed_lower_bytes":0,"nested_deep_total_µs":84,"nested_deep_per_iter_µs":0.42,"nested_deep_rule_evals":9,"nested_deep_predicate_evals":3,"nested_deep_predicate_true":1,"nested_deep_predicate_false":1,"nested_deep_regex_cache_hits":0,"nested_deep_regex_cache_misses":0,"nested_deep_tokenize_calls":0,"nested_deep_tokens_produced":0,"nested_deep_semantic_similarity_calls":0,"nested_deep_entity_detection_calls":0,"nested_deep_url_extract_calls":0,"nested_deep_section_scan_calls":0,"nested_deep_chain_traversals":0,"nested_deep_triggered_rules":4,"nested_deep_all_short_circuits":1,"nested_deep_any_short_circuits":0,"nested_deep_not_short_circuits":0,"nested_deep_max_chain_depth":0,"nested_deep_language_detect_calls":0,"nested_deep_lower_allocations":0,"nested_deep_lower_bytes":0,"large_doc_entities_total_µs":250,"large_doc_entities_per_iter_µs":2.5,"large_doc_entities_rule_evals":32,"large_doc_entities_predicate_evals":1,"large_doc_entities_predicate_true":0,"large_doc_entities_predicate_false":0,"large_doc_entities_regex_cache_hits":0,"large_doc_entities_regex_cache_misses":0,"large_doc_entities_tokenize_calls":0,"large_doc_entities_tokens_produced":0,"large_doc_entities_semantic_similarity_calls":0,"large_doc_entities_entity_detection_calls":0,"large_doc_entities_url_extract_calls":0,"large_doc_entities_section_scan_calls":0,"large_doc_entities_chain_traversals":0,"large_doc_entities_triggered_rules":21,"large_doc_entities_all_short_circuits":0,"large_doc_entities_any_short_circuits":0,"large_doc_entities_not_short_circuits":0,"large_doc_entities_max_chain_depth":0,"large_doc_entities_language_detect_calls":0,"large_doc_entities_lower_allocations":0,"large_doc_entities_lower_bytes":0},"status":"keep","description":"Baseline benchmark run after rebaselining due to non-reproducible incremental build artifacts","timestamp":1778437331535,"segment":2,"confidence":null,"asi":{"hypothesis":"Previous baseline of 0.40µs was not reproducible on clean builds due to compiler code layout heuristics. Rebaselining to 0.63µs which is consistently achievable on clean builds."}}
