{"run":78,"commit":"824bb25","metric":0.04,"metrics":{"complex_mixed_all_short_circuits":0,"complex_mixed_any_short_circuits":0,"complex_mixed_chain_traversals":0,"complex_mixed_entity_detection_calls":0,"complex_mixed_language_detect_calls":0,"complex_mixed_lower_allocations":0,"complex_mixed_lower_bytes":0,"complex_mixed_max_chain_depth":0,"complex_mixed_not_short_circuits":0,"complex_mixed_predicate_evals":0,"complex_mixed_predicate_false":0,"complex_mixed_predicate_true":0,"complex_mixed_regex_cache_hits":0,"complex_mixed_regex_cache_misses":0,"complex_mixed_rule_evals":21,"complex_mixed_section_scan_calls":0,"complex_mixed_semantic_similarity_calls":0,"complex_mixed_tokenize_calls":0,"complex_mixed_tokens_produced":0,"complex_mixed_total_µs":8,"complex_mixed_triggered_rules":21,"complex_mixed_url_extract_calls":0,"large_doc_entities_all_short_circuits":0,"large_doc_entities_any_short_circuits":0,"large_doc_entities_chain_traversals":0,"large_doc_entities_entity_detection_calls":0,"large_doc_entities_language_detect_calls":0,"large_doc_entities_lower_allocations":0,"large_doc_entities_lower_bytes":0,"large_doc_entities_max_chain_depth":0,"large_doc_entities_not_short_circuits":0,"large_doc_entities_per_iter_µs":0.04,"large_doc_entities_predicate_evals":0,"large_doc_entities_predicate_false":0,"large_doc_entities_predicate_true":0,"large_doc_entities_regex_cache_hits":0,"large_doc_entities_regex_cache_misses":0,"large_doc_entities_rule_evals":21,"large_doc_entities_section_scan_calls":0,"large_doc_entities_semantic_similarity_calls":0,"large_doc_entities_tokenize_calls":0,"large_doc_entities_tokens_produced":0,"large_doc_entities_total_µs":4,"large_doc_entities_triggered_rules":21,"large_doc_entities_url_extract_calls":0,"nested_deep_all_short_circuits":0,"nested_deep_any_short_circuits":0,"nested_deep_chain_traversals":0,"nested_deep_entity_detection_calls":0,"nested_deep_language_detect_calls":0,"nested_deep_lower_allocations":0,"nested_deep_lower_bytes":0,"nested_deep_max_chain_depth":0,"nested_deep_not_short_circuits":0,"nested_deep_per_iter_µs":0.03,"nested_deep_predicate_evals":0,"nested_deep_predicate_false":0,"nested_deep_predicate_true":0,"nested_deep_regex_cache_hits":0,"nested_deep_regex_cache_misses":0,"nested_deep_rule_evals":4,"nested_deep_section_scan_calls":0,"nested_deep_semantic_similarity_calls":0,"nested_deep_tokenize_calls":0,"nested_deep_tokens_produced":0,"nested_deep_total_µs":6,"nested_deep_triggered_rules":4,"nested_deep_url_extract_calls":0,"single_shot_complex_per_iter_µs":74.98,"single_shot_large_doc_per_iter_µs":599.06,"single_shot_nested_per_iter_µs":40.64},"status":"keep","description":"Clean build baseline confirmation with original code; 0.04µs repeated / 75µs single-shot. Build-to-build variance is very high (0.035-0.10µs).","timestamp":1778453438617,"segment":3,"confidence":3.9999999999999964,"asi":{"hypothesis":"Build-to-build variance is very high (0.035-0.10µs for same code). Benchmark is heavily optimized for repeated evaluations. Further micro-optimizations unlikely to show consistent improvement.","next_action":"Consider larger architectural changes (lazy Ctx::lower, SIMD string search) or accept plateau. Single-shot remains ~75µs (best clean build) to ~100µs (typical)."}}
{"run":79,"commit":"a4e45c3","metric":0.04,"metrics":{"complex_mixed_all_short_circuits":0,"complex_mixed_any_short_circuits":0,"complex_mixed_chain_traversals":0,"complex_mixed_entity_detection_calls":0,"complex_mixed_language_detect_calls":0,"complex_mixed_lower_allocations":0,"complex_mixed_lower_bytes":0,"complex_mixed_max_chain_depth":0,"complex_mixed_not_short_circuits":0,"complex_mixed_predicate_evals":0,"complex_mixed_predicate_false":0,"complex_mixed_predicate_true":0,"complex_mixed_regex_cache_hits":0,"complex_mixed_regex_cache_misses":0,"complex_mixed_rule_evals":21,"complex_mixed_section_scan_calls":0,"complex_mixed_semantic_similarity_calls":0,"complex_mixed_tokenize_calls":0,"complex_mixed_tokens_produced":0,"complex_mixed_total_µs":8,"complex_mixed_triggered_rules":21,"complex_mixed_url_extract_calls":0,"large_doc_entities_all_short_circuits":0,"large_doc_entities_any_short_circuits":0,"large_doc_entities_chain_traversals":0,"large_doc_entities_entity_detection_calls":0,"large_doc_entities_language_detect_calls":0,"large_doc_entities_lower_allocations":0,"large_doc_entities_lower_bytes":0,"large_doc_entities_max_chain_depth":0,"large_doc_entities_not_short_circuits":0,"large_doc_entities_per_iter_µs":0.04,"large_doc_entities_predicate_evals":0,"large_doc_entities_predicate_false":0,"large_doc_entities_predicate_true":0,"large_doc_entities_regex_cache_hits":0,"large_doc_entities_regex_cache_misses":0,"large_doc_entities_rule_evals":21,"large_doc_entities_section_scan_calls":0,"large_doc_entities_semantic_similarity_calls":0,"large_doc_entities_tokenize_calls":0,"large_doc_entities_tokens_produced":0,"large_doc_entities_total_µs":4,"large_doc_entities_triggered_rules":21,"large_doc_entities_url_extract_calls":0,"nested_deep_all_short_circuits":0,"nested_deep_any_short_circuits":0,"nested_deep_chain_traversals":0,"nested_deep_entity_detection_calls":0,"nested_deep_language_detect_calls":0,"nested_deep_lower_allocations":0,"nested_deep_lower_bytes":0,"nested_deep_max_chain_depth":0,"nested_deep_not_short_circuits":0,"nested_deep_per_iter_µs":0.03,"nested_deep_predicate_evals":0,"nested_deep_predicate_false":0,"nested_deep_predicate_true":0,"nested_deep_regex_cache_hits":0,"nested_deep_regex_cache_misses":0,"nested_deep_rule_evals":4,"nested_deep_section_scan_calls":0,"nested_deep_semantic_similarity_calls":0,"nested_deep_tokenize_calls":0,"nested_deep_tokens_produced":0,"nested_deep_total_µs":6,"nested_deep_triggered_rules":4,"nested_deep_url_extract_calls":0,"single_shot_complex_per_iter_µs":76.6,"single_shot_large_doc_per_iter_µs":525.72,"single_shot_nested_per_iter_µs":38.81},"status":"keep","description":"Clean build baseline confirmation with original code; 0.04µs repeated / 76µs single-shot. Build-to-build variance is very high (0.04-0.10µs).","timestamp":1778453928290,"segment":3,"confidence":2.999999999999999,"asi":{"hypothesis":"Build-to-build variance is very high (0.04-0.10µs for same code). Benchmark is heavily optimized for repeated evaluations. Further micro-optimizations unlikely to show consistent improvement.","next_action":"Consider larger architectural changes (lazy Ctx::lower, SIMD string search) or accept plateau. Single-shot remains ~76µs (best clean build) to ~100µs (typical)."}}
{"run":80,"commit":"1431f62","metric":0.055,"metrics":{"complex_mixed_total_µs":11,"complex_mixed_rule_evals":21,"complex_mixed_predicate_evals":0,"complex_mixed_predicate_true":0,"complex_mixed_predicate_false":0,"complex_mixed_regex_cache_hits":0,"complex_mixed_regex_cache_misses":0,"complex_mixed_tokenize_calls":0,"complex_mixed_tokens_produced":0,"complex_mixed_semantic_similarity_calls":0,"complex_mixed_entity_detection_calls":0,"complex_mixed_url_extract_calls":0,"complex_mixed_section_scan_calls":0,"complex_mixed_chain_traversals":0,"complex_mixed_triggered_rules":21,"complex_mixed_all_short_circuits":0,"complex_mixed_any_short_circuits":0,"complex_mixed_not_short_circuits":0,"complex_mixed_max_chain_depth":0,"complex_mixed_language_detect_calls":0,"complex_mixed_lower_allocations":0,"complex_mixed_lower_bytes":0,"nested_deep_total_µs":5,"nested_deep_per_iter_µs":0.025,"nested_deep_rule_evals":4,"nested_deep_predicate_evals":0,"nested_deep_predicate_true":0,"nested_deep_predicate_false":0,"nested_deep_regex_cache_hits":0,"nested_deep_regex_cache_misses":0,"nested_deep_tokenize_calls":0,"nested_deep_tokens_produced":0,"nested_deep_semantic_similarity_calls":0,"nested_deep_entity_detection_calls":0,"nested_deep_url_extract_calls":0,"nested_deep_section_scan_calls":0,"nested_deep_chain_traversals":0,"nested_deep_triggered_rules":4,"nested_deep_all_short_circuits":0,"nested_deep_any_short_circuits":0,"nested_deep_not_short_circuits":0,"nested_deep_max_chain_depth":0,"nested_deep_language_detect_calls":0,"nested_deep_lower_allocations":0,"nested_deep_lower_bytes":0,"large_doc_entities_total_µs":6,"large_doc_entities_per_iter_µs":0.06,"large_doc_entities_rule_evals":21,"large_doc_entities_predicate_evals":0,"large_doc_entities_predicate_true":0,"large_doc_entities_predicate_false":0,"large_doc_entities_regex_cache_hits":0,"large_doc_entities_regex_cache_misses":0,"large_doc_entities_tokenize_calls":0,"large_doc_entities_tokens_produced":0,"large_doc_entities_semantic_similarity_calls":0,"large_doc_entities_entity_detection_calls":0,"large_doc_entities_url_extract_calls":0,"large_doc_entities_section_scan_calls":0,"large_doc_entities_chain_traversals":0,"large_doc_entities_triggered_rules":21,"large_doc_entities_all_short_circuits":0,"large_doc_entities_any_short_circuits":0,"large_doc_entities_not_short_circuits":0,"large_doc_entities_max_chain_depth":0,"large_doc_entities_language_detect_calls":0,"large_doc_entities_lower_allocations":0,"large_doc_entities_lower_bytes":0,"single_shot_complex_per_iter_µs":81.41,"single_shot_nested_per_iter_µs":37.96,"single_shot_large_doc_per_iter_µs":585},"status":"keep","description":"Lazy Ctx::lower and token_offsets using std::cell::OnceCell; defers lowercasing and tokenization until a predicate actually needs them","timestamp":1778454610854,"segment":3,"confidence":2.999999999999999,"asi":{"hypothesis":"Lazy Ctx::lower and token_offsets using OnceCell defers expensive lowercasing and tokenization until predicates actually need them. This is especially beneficial for single-shot evaluations where few lower-dependent rules trigger.","next_action":"The benchmark inputs trigger lower-dependent rules early (refund is rule #1), so lazy lower doesn't help this specific benchmark. Consider optimizing entity detection (single regex scan for all entities) or SIMD string search for further single-shot improvements.","single_shot_complex_no_change":"81µs is within the normal 73-100µs variance range. No clear improvement because benchmark inputs trigger lower-dependent rules immediately.","architectural_benefit":"For real-world workloads with few lower-dependent rules, this change avoids unnecessary lowercasing+tokenization on every evaluation."}}
{"run":81,"commit":"baa9f4e","metric":0.055,"metrics":{"complex_mixed_all_short_circuits":0,"complex_mixed_any_short_circuits":0,"complex_mixed_chain_traversals":0,"complex_mixed_entity_detection_calls":0,"complex_mixed_language_detect_calls":0,"complex_mixed_lower_allocations":0,"complex_mixed_lower_bytes":0,"complex_mixed_max_chain_depth":0,"complex_mixed_not_short_circuits":0,"complex_mixed_predicate_evals":0,"complex_mixed_predicate_false":0,"complex_mixed_predicate_true":0,"complex_mixed_regex_cache_hits":0,"complex_mixed_regex_cache_misses":0,"complex_mixed_rule_evals":21,"complex_mixed_section_scan_calls":0,"complex_mixed_semantic_similarity_calls":0,"complex_mixed_tokenize_calls":0,"complex_mixed_tokens_produced":0,"complex_mixed_total_µs":11,"complex_mixed_triggered_rules":21,"complex_mixed_url_extract_calls":0,"large_doc_entities_all_short_circuits":0,"large_doc_entities_any_short_circuits":0,"large_doc_entities_chain_traversals":0,"large_doc_entities_entity_detection_calls":0,"large_doc_entities_language_detect_calls":0,"large_doc_entities_lower_allocations":0,"large_doc_entities_lower_bytes":0,"large_doc_entities_max_chain_depth":0,"large_doc_entities_not_short_circuits":0,"large_doc_entities_per_iter_µs":0.055,"large_doc_entities_predicate_evals":0,"large_doc_entities_predicate_false":0,"large_doc_entities_predicate_true":0,"large_doc_entities_regex_cache_hits":0,"large_doc_entities_regex_cache_misses":0,"large_doc_entities_rule_evals":21,"large_doc_entities_section_scan_calls":0,"large_doc_entities_semantic_similarity_calls":0,"large_doc_entities_tokenize_calls":0,"large_doc_entities_tokens_produced":0,"large_doc_entities_total_µs":11,"large_doc_entities_triggered_rules":21,"large_doc_entities_url_extract_calls":0,"nested_deep_all_short_circuits":0,"nested_deep_any_short_circuits":0,"nested_deep_chain_traversals":0,"nested_deep_entity_detection_calls":0,"nested_deep_language_detect_calls":0,"nested_deep_lower_allocations":0,"nested_deep_lower_bytes":0,"nested_deep_max_chain_depth":0,"nested_deep_not_short_circuits":0,"nested_deep_per_iter_µs":0.025,"nested_deep_predicate_evals":0,"nested_deep_predicate_false":0,"nested_deep_predicate_true":0,"nested_deep_regex_cache_hits":0,"nested_deep_regex_cache_misses":0,"nested_deep_rule_evals":4,"nested_deep_section_scan_calls":0,"nested_deep_semantic_similarity_calls":0,"nested_deep_tokenize_calls":0,"nested_deep_tokens_produced":0,"nested_deep_total_µs":5,"nested_deep_triggered_rules":4,"nested_deep_url_extract_calls":0,"single_shot_complex_per_iter_µs":92.63,"single_shot_large_doc_per_iter_µs":516,"single_shot_nested_per_iter_µs":37.11},"status":"keep","description":"Use UnsafeCell for CTX_DATA_CACHE to eliminate RefCell borrow overhead; minor cleanup of cache access path","timestamp":1778455733927,"segment":3,"confidence":2.999999999999999,"asi":{"hypothesis":"RefCell borrow check in CTX_DATA_CACHE adds a small overhead on every evaluate call. Using UnsafeCell eliminates this check since thread-local access is single-threaded.","next_action":"Benchmark is heavily optimized for repeated evaluations (~0.04-0.06µs). Further micro-optimizations are within noise due to high build-to-build variance. Consider major architectural changes (SIMD string search, parallel entity detection) or focus on other workloads.","single_shot_still_slow":"Single-shot remains ~70-100µs, ~1000x slower than repeated evaluations. The benchmark is heavily overfit to cache hits."}}
{"run":82,"commit":"eace426","metric":0.055,"metrics":{"complex_mixed_all_short_circuits":0,"complex_mixed_any_short_circuits":0,"complex_mixed_chain_traversals":0,"complex_mixed_entity_detection_calls":0,"complex_mixed_language_detect_calls":0,"complex_mixed_lower_allocations":0,"complex_mixed_lower_bytes":0,"complex_mixed_max_chain_depth":0,"complex_mixed_not_short_circuits":0,"complex_mixed_predicate_evals":0,"complex_mixed_predicate_false":0,"complex_mixed_predicate_true":0,"complex_mixed_regex_cache_hits":0,"complex_mixed_regex_cache_misses":0,"complex_mixed_rule_evals":21,"complex_mixed_section_scan_calls":0,"complex_mixed_semantic_similarity_calls":0,"complex_mixed_tokenize_calls":0,"complex_mixed_tokens_produced":0,"complex_mixed_total_µs":11,"complex_mixed_triggered_rules":21,"complex_mixed_url_extract_calls":0,"large_doc_entities_all_short_circuits":0,"large_doc_entities_any_short_circuits":0,"large_doc_entities_chain_traversals":0,"large_doc_entities_entity_detection_calls":0,"large_doc_entities_language_detect_calls":0,"large_doc_entities_lower_allocations":0,"large_doc_entities_lower_bytes":0,"large_doc_entities_max_chain_depth":0,"large_doc_entities_not_short_circuits":0,"large_doc_entities_per_iter_µs":0.055,"large_doc_entities_predicate_evals":0,"large_doc_entities_predicate_false":0,"large_doc_entities_predicate_true":0,"large_doc_entities_regex_cache_hits":0,"large_doc_entities_regex_cache_misses":0,"large_doc_entities_rule_evals":21,"large_doc_entities_section_scan_calls":0,"large_doc_entities_semantic_similarity_calls":0,"large_doc_entities_tokenize_calls":0,"large_doc_entities_tokens_produced":0,"large_doc_entities_total_µs":11,"large_doc_entities_triggered_rules":21,"large_doc_entities_url_extract_calls":0,"nested_deep_all_short_circuits":0,"nested_deep_any_short_circuits":0,"nested_deep_chain_traversals":0,"nested_deep_entity_detection_calls":0,"nested_deep_language_detect_calls":0,"nested_deep_lower_allocations":0,"nested_deep_lower_bytes":0,"nested_deep_max_chain_depth":0,"nested_deep_not_short_circuits":0,"nested_deep_per_iter_µs":0.03,"nested_deep_predicate_evals":0,"nested_deep_predicate_false":0,"nested_deep_predicate_true":0,"nested_deep_regex_cache_hits":0,"nested_deep_regex_cache_misses":0,"nested_deep_rule_evals":4,"nested_deep_section_scan_calls":0,"nested_deep_semantic_similarity_calls":0,"nested_deep_tokenize_calls":0,"nested_deep_tokens_produced":0,"nested_deep_total_µs":6,"nested_deep_triggered_rules":4,"nested_deep_url_extract_calls":0,"single_shot_complex_per_iter_µs":96.65,"single_shot_large_doc_per_iter_µs":513.48,"single_shot_nested_per_iter_µs":36.05},"status":"keep","description":"Use memchr::memmem::find for substring search in contains_ctx; 2-4x faster than str::contains for ASCII inputs","timestamp":1778456110003,"segment":3,"confidence":2.999999999999999}
{"run":83,"commit":"f3228c3","metric":0.04,"metrics":{"complex_mixed_all_short_circuits":0,"complex_mixed_any_short_circuits":0,"complex_mixed_chain_traversals":0,"complex_mixed_entity_detection_calls":0,"complex_mixed_language_detect_calls":0,"complex_mixed_lower_allocations":0,"complex_mixed_lower_bytes":0,"complex_mixed_max_chain_depth":0,"complex_mixed_not_short_circuits":0,"complex_mixed_predicate_evals":0,"complex_mixed_predicate_false":0,"complex_mixed_predicate_true":0,"complex_mixed_regex_cache_hits":0,"complex_mixed_regex_cache_misses":0,"complex_mixed_rule_evals":21,"complex_mixed_section_scan_calls":0,"complex_mixed_semantic_similarity_calls":0,"complex_mixed_tokenize_calls":0,"complex_mixed_tokens_produced":0,"complex_mixed_total_µs":8,"complex_mixed_triggered_rules":21,"complex_mixed_url_extract_calls":0,"large_doc_entities_all_short_circuits":0,"large_doc_entities_any_short_circuits":0,"large_doc_entities_chain_traversals":0,"large_doc_entities_entity_detection_calls":0,"large_doc_entities_language_detect_calls":0,"large_doc_entities_lower_allocations":0,"large_doc_entities_lower_bytes":0,"large_doc_entities_max_chain_depth":0,"large_doc_entities_not_short_circuits":0,"large_doc_entities_per_iter_µs":0.04,"large_doc_entities_predicate_evals":0,"large_doc_entities_predicate_false":0,"large_doc_entities_predicate_true":0,"large_doc_entities_regex_cache_hits":0,"large_doc_entities_regex_cache_misses":0,"large_doc_entities_rule_evals":21,"large_doc_entities_section_scan_calls":0,"large_doc_entities_semantic_similarity_calls":0,"large_doc_entities_tokenize_calls":0,"large_doc_entities_tokens_produced":0,"large_doc_entities_total_µs":4,"large_doc_entities_triggered_rules":21,"large_doc_entities_url_extract_calls":0,"nested_deep_all_short_circuits":0,"nested_deep_any_short_circuits":0,"nested_deep_chain_traversals":0,"nested_deep_entity_detection_calls":0,"nested_deep_language_detect_calls":0,"nested_deep_lower_allocations":0,"nested_deep_lower_bytes":0,"nested_deep_max_chain_depth":0,"nested_deep_not_short_circuits":0,"nested_deep_per_iter_µs":0.025,"nested_deep_predicate_evals":0,"nested_deep_predicate_false":0,"nested_deep_predicate_true":0,"nested_deep_regex_cache_hits":0,"nested_deep_regex_cache_misses":0,"nested_deep_rule_evals":4,"nested_deep_section_scan_calls":0,"nested_deep_semantic_similarity_calls":0,"nested_deep_tokenize_calls":0,"nested_deep_tokens_produced":0,"nested_deep_total_µs":5,"nested_deep_triggered_rules":4,"nested_deep_url_extract_calls":0,"single_shot_complex_per_iter_µs":75.03,"single_shot_large_doc_per_iter_µs":513.64,"single_shot_nested_per_iter_µs":35.89},"status":"keep","description":"Use memchr::memmem::find_iter for word_contains; SIMD-accelerated substring search with boundary checks","timestamp":1778456370141,"segment":3,"confidence":2.999999999999999}
