{"type":"config","name":"Optimizing iratxo engine execution speed","metricName":"total_µs","metricUnit":"µs","bestDirection":"lower"}
{"run":1,"commit":"0ebf357","metric":392.08,"metrics":{"keyword_µs":139.31,"regex_µs":249.18,"semantic_µs":3.59},"status":"keep","description":"Baseline benchmark run","timestamp":1777657774324,"segment":0,"confidence":null,"asi":{"hypothesis":"Baseline measurement before any optimizations"}}
{"run":2,"commit":"0ebf357","metric":33.57,"metrics":{"keyword_µs":11.49,"regex_µs":18.52,"semantic_µs":3.57},"status":"keep","description":"Add global regex cache and lazy lowercase input cache","timestamp":1777657891879,"segment":0,"confidence":null,"asi":{"hypothesis":"Regex recompilation per evaluate() and repeated to_lowercase() on input are the main bottlenecks.","changes":"1. Replaced per-evaluation regex cache with a thread-local global cache. 2. Added lazy lowercase cache in Ctx to avoid repeated to_lowercase() calls for case-insensitive contains.","result":"Massive improvement: keyword -91.8%, regex -92.4%. Total from 392µs to 34µs."}}
{"run":3,"commit":"e543cc5","metric":34.54,"metrics":{"keyword_µs":11.75,"regex_µs":19.09,"semantic_µs":3.69},"status":"keep","description":"Cache stemmers per-language and avoid double-lowercase in language detection","timestamp":1777658138900,"segment":0,"confidence":369.5979381443303,"asi":{"hypothesis":"Stemmer creation and redundant lowercasing in detect_language are micro-optimizations that help semantic workloads.","changes":"1. Use OnceLock to cache English/Spanish stemmers. 2. Pass pre-lowercased string to tokenize in detect_language. 3. Remove dead contains() helper.","result":"No significant change on current benchmarks (within noise), but removes redundant work and caches expensive stemmer construction."}}
{"run":4,"commit":"17955ae","metric":33.13,"metrics":{"keyword_µs":11.34,"regex_µs":18.25,"semantic_µs":3.54},"status":"keep","description":"FxHashMap for regex cache + eager lowercase + pre-lowercased needles","timestamp":1777658578892,"segment":0,"confidence":509.148936170214,"asi":{"changes":"1. Thread-local global regex cache with FxHashMap. 2. Eager lowercase in Ctx. 3. Pre-lowercase needles at compile time for case-insensitive predicates. 4. OnceLock-cached stemmers.","hypothesis":"Combined micro-optimizations should reduce allocations and hashmap overhead.","result":"New best total 33.13µs. Keyword 11.34, regex 18.25, semantic 3.54."}}
{"run":5,"commit":"f80b878","metric":32.98,"metrics":{"keyword_µs":11.28,"regex_µs":18.18,"semantic_µs":3.53},"status":"keep","description":"Replace by_id HashMap with linear scan over rules slice","timestamp":1777658680992,"segment":0,"confidence":608.6440677966066,"asi":{"changes":"Removed per-evaluate HashMap construction for rule lookup; use linear scan instead.","hypothesis":"For small rule sets, linear scan is faster than HashMap allocation and lookup.","result":"Slight improvement to 32.98µs total."}}
{"run":6,"commit":"419a2be","metric":19.81,"metrics":{"keyword_µs":4.36,"regex_µs":11.75,"semantic_µs":3.69},"status":"keep","description":"Disable Unicode mode for ASCII-only regex patterns","timestamp":1777658887831,"segment":0,"confidence":477.26923076923003,"asi":{"changes":"Added is_ascii_only_regex() heuristic to set RegexBuilder.unicode(false) for ASCII-only patterns without \\p{...} escapes.","hypothesis":"Regex engine Unicode mode adds overhead for ASCII-only patterns; disabling it should speed up matching.","result":"Huge win: keyword -61%, regex -35%, total -40%. Total dropped from 33µs to 19.8µs."}}
{"run":7,"commit":"0ebf357","metric":55.08,"metrics":{"keyword_µs":9.94,"regex_µs":40.96,"semantic_µs":4.18},"status":"discard","description":"RegexSet batching for regex predicates — 3x slower, reverted","timestamp":1777660457785,"segment":0,"confidence":383.7835051546396,"asi":{"hypothesis":"RegexSet should scan all patterns in one pass, faster than 6 individual regex scans.","rollback_reason":"RegexSet with wrapped patterns is 3x slower than individual cached regexes for small pattern counts (6).","next_action_hint":"Avoid RegexSet for small pattern counts. Individual regexes with unicode(false) are optimal."}}
{"type":"config","name":"Optimizing iratxo complex rules performance","metricName":"complex_mixed_per_iter_µs","metricUnit":"µs","bestDirection":"lower"}
{"run":8,"commit":"65a751c","metric":178.47,"metrics":{"complex_mixed_total_µs":35693,"complex_mixed_rule_evals":33,"complex_mixed_predicate_evals":34,"complex_mixed_predicate_true":21,"complex_mixed_predicate_false":11,"complex_mixed_regex_cache_hits":1,"complex_mixed_regex_cache_misses":0,"complex_mixed_tokenize_calls":2,"complex_mixed_tokens_produced":490,"complex_mixed_semantic_similarity_calls":2,"complex_mixed_entity_detection_calls":9,"complex_mixed_url_extract_calls":1,"complex_mixed_section_scan_calls":1,"complex_mixed_chain_traversals":0,"complex_mixed_triggered_rules":22,"complex_mixed_all_short_circuits":0,"complex_mixed_any_short_circuits":0,"complex_mixed_not_short_circuits":1,"complex_mixed_max_chain_depth":0,"complex_mixed_language_detect_calls":1,"complex_mixed_lower_allocations":1,"complex_mixed_lower_bytes":1560,"nested_deep_total_µs":18994,"nested_deep_per_iter_µs":94.97,"nested_deep_rule_evals":10,"nested_deep_predicate_evals":34,"nested_deep_predicate_true":17,"nested_deep_predicate_false":16,"nested_deep_regex_cache_hits":0,"nested_deep_regex_cache_misses":0,"nested_deep_tokenize_calls":0,"nested_deep_tokens_produced":0,"nested_deep_semantic_similarity_calls":1,"nested_deep_entity_detection_calls":2,"nested_deep_url_extract_calls":1,"nested_deep_section_scan_calls":1,"nested_deep_chain_traversals":0,"nested_deep_triggered_rules":5,"nested_deep_all_short_circuits":8,"nested_deep_any_short_circuits":2,"nested_deep_not_short_circuits":1,"nested_deep_max_chain_depth":0,"nested_deep_language_detect_calls":2,"nested_deep_lower_allocations":1,"nested_deep_lower_bytes":1560,"large_doc_entities_total_µs":121086,"large_doc_entities_per_iter_µs":1210.86,"large_doc_entities_rule_evals":33,"large_doc_entities_predicate_evals":34,"large_doc_entities_predicate_true":21,"large_doc_entities_predicate_false":11,"large_doc_entities_regex_cache_hits":1,"large_doc_entities_regex_cache_misses":0,"large_doc_entities_tokenize_calls":2,"large_doc_entities_tokens_produced":4892,"large_doc_entities_semantic_similarity_calls":2,"large_doc_entities_entity_detection_calls":9,"large_doc_entities_url_extract_calls":1,"large_doc_entities_section_scan_calls":1,"large_doc_entities_chain_traversals":0,"large_doc_entities_triggered_rules":22,"large_doc_entities_all_short_circuits":0,"large_doc_entities_any_short_circuits":0,"large_doc_entities_not_short_circuits":1,"large_doc_entities_max_chain_depth":0,"large_doc_entities_language_detect_calls":1,"large_doc_entities_lower_allocations":1,"large_doc_entities_lower_bytes":11162},"status":"keep","description":"Baseline complex rules benchmark with rich metrics","timestamp":1777749136714,"segment":1,"confidence":null,"asi":{"hypothesis":"Baseline measurement with complex rules and rich metrics to identify bottlenecks"}}
{"run":9,"commit":"c71c6b5","metric":142.21,"metrics":{"complex_mixed_total_µs":28442,"complex_mixed_rule_evals":32,"complex_mixed_predicate_evals":33,"complex_mixed_predicate_true":20,"complex_mixed_predicate_false":11,"complex_mixed_regex_cache_hits":1,"complex_mixed_regex_cache_misses":0,"complex_mixed_tokenize_calls":2,"complex_mixed_tokens_produced":490,"complex_mixed_semantic_similarity_calls":2,"complex_mixed_entity_detection_calls":9,"complex_mixed_url_extract_calls":1,"complex_mixed_section_scan_calls":1,"complex_mixed_chain_traversals":0,"complex_mixed_triggered_rules":21,"complex_mixed_all_short_circuits":0,"complex_mixed_any_short_circuits":0,"complex_mixed_not_short_circuits":1,"complex_mixed_max_chain_depth":0,"complex_mixed_language_detect_calls":0,"complex_mixed_lower_allocations":1,"complex_mixed_lower_bytes":1560,"nested_deep_total_µs":18950,"nested_deep_per_iter_µs":94.75,"nested_deep_rule_evals":9,"nested_deep_predicate_evals":33,"nested_deep_predicate_true":16,"nested_deep_predicate_false":16,"nested_deep_regex_cache_hits":0,"nested_deep_regex_cache_misses":0,"nested_deep_tokenize_calls":0,"nested_deep_tokens_produced":0,"nested_deep_semantic_similarity_calls":1,"nested_deep_entity_detection_calls":2,"nested_deep_url_extract_calls":1,"nested_deep_section_scan_calls":1,"nested_deep_chain_traversals":0,"nested_deep_triggered_rules":4,"nested_deep_all_short_circuits":8,"nested_deep_any_short_circuits":2,"nested_deep_not_short_circuits":1,"nested_deep_max_chain_depth":0,"nested_deep_language_detect_calls":1,"nested_deep_lower_allocations":1,"nested_deep_lower_bytes":1560,"large_doc_entities_total_µs":108709,"large_doc_entities_per_iter_µs":1087.09,"large_doc_entities_rule_evals":32,"large_doc_entities_predicate_evals":33,"large_doc_entities_predicate_true":20,"large_doc_entities_predicate_false":11,"large_doc_entities_regex_cache_hits":1,"large_doc_entities_regex_cache_misses":0,"large_doc_entities_tokenize_calls":2,"large_doc_entities_tokens_produced":4892,"large_doc_entities_semantic_similarity_calls":2,"large_doc_entities_entity_detection_calls":9,"large_doc_entities_url_extract_calls":1,"large_doc_entities_section_scan_calls":1,"large_doc_entities_chain_traversals":0,"large_doc_entities_triggered_rules":21,"large_doc_entities_all_short_circuits":0,"large_doc_entities_any_short_circuits":0,"large_doc_entities_not_short_circuits":1,"large_doc_entities_max_chain_depth":0,"large_doc_entities_language_detect_calls":0,"large_doc_entities_lower_allocations":1,"large_doc_entities_lower_bytes":11162},"status":"keep","description":"Short-circuit entity detection for min_count<=1 using is_match() instead of find_iter().count()","timestamp":1777749473601,"segment":1,"confidence":null,"asi":{"changes":"1. Short-circuit entity detection using is_match()/any()/find() when min_count<=1. 2. Skip chained-target rules in top-level loop. 3. Cache per-eval language, entity counts, URL hosts in Ctx. 4. has_section uses ctx.lower() instead of re-lowercasing.","hypothesis":"Entity detection was doing full find_iter().count() scans even when only 1 match was needed. Using is_match() for min_count<=1 avoids scanning past the first match.","result":"complex_mixed improved from 178µs to 142µs (-20%). large_doc_entities improved from 1210µs to 1087µs (-10%)."}}
{"run":10,"commit":"569c340","metric":100.8,"metrics":{"complex_mixed_all_short_circuits":0,"complex_mixed_any_short_circuits":0,"complex_mixed_chain_traversals":0,"complex_mixed_entity_detection_calls":9,"complex_mixed_language_detect_calls":0,"complex_mixed_lower_allocations":1,"complex_mixed_lower_bytes":1560,"complex_mixed_max_chain_depth":0,"complex_mixed_not_short_circuits":1,"complex_mixed_predicate_evals":33,"complex_mixed_predicate_false":11,"complex_mixed_predicate_true":20,"complex_mixed_regex_cache_hits":1,"complex_mixed_regex_cache_misses":0,"complex_mixed_rule_evals":32,"complex_mixed_section_scan_calls":1,"complex_mixed_semantic_similarity_calls":2,"complex_mixed_tokenize_calls":2,"complex_mixed_tokens_produced":490,"complex_mixed_total_µs":20159,"complex_mixed_triggered_rules":21,"complex_mixed_url_extract_calls":1,"large_doc_entities_all_short_circuits":0,"large_doc_entities_any_short_circuits":0,"large_doc_entities_chain_traversals":0,"large_doc_entities_entity_detection_calls":9,"large_doc_entities_language_detect_calls":0,"large_doc_entities_lower_allocations":1,"large_doc_entities_lower_bytes":11162,"large_doc_entities_max_chain_depth":0,"large_doc_entities_not_short_circuits":1,"large_doc_entities_per_iter_µs":736.9,"large_doc_entities_predicate_evals":33,"large_doc_entities_predicate_false":11,"large_doc_entities_predicate_true":20,"large_doc_entities_regex_cache_hits":1,"large_doc_entities_regex_cache_misses":0,"large_doc_entities_rule_evals":32,"large_doc_entities_section_scan_calls":1,"large_doc_entities_semantic_similarity_calls":2,"large_doc_entities_tokenize_calls":2,"large_doc_entities_tokens_produced":4892,"large_doc_entities_total_µs":73690,"large_doc_entities_triggered_rules":21,"large_doc_entities_url_extract_calls":1,"nested_deep_all_short_circuits":8,"nested_deep_any_short_circuits":2,"nested_deep_chain_traversals":0,"nested_deep_entity_detection_calls":2,"nested_deep_language_detect_calls":1,"nested_deep_lower_allocations":1,"nested_deep_lower_bytes":1560,"nested_deep_max_chain_depth":0,"nested_deep_not_short_circuits":1,"nested_deep_per_iter_µs":100.38,"nested_deep_predicate_evals":33,"nested_deep_predicate_false":16,"nested_deep_predicate_true":16,"nested_deep_regex_cache_hits":0,"nested_deep_regex_cache_misses":0,"nested_deep_rule_evals":9,"nested_deep_section_scan_calls":1,"nested_deep_semantic_similarity_calls":1,"nested_deep_tokenize_calls":0,"nested_deep_tokens_produced":0,"nested_deep_total_µs":20076,"nested_deep_triggered_rules":4,"nested_deep_url_extract_calls":1},"status":"keep","description":"Cache semantic input embedding across multiple examples in same evaluate() call","timestamp":1777749598001,"segment":1,"confidence":2.1420297848869283,"asi":{"changes":"1. Exposed embed_input() and cosine() from semantic module. 2. Added semantic_embed cache to Ctx keyed by (language, extra_synonyms_hash). 3. In SemanticMatch predicate, embed input once then reuse for all examples.","hypothesis":"SemanticMatch with multiple examples was re-tokenizing, stemming, and hashing the (potentially large) input text for every example. Caching the input embedding eliminates redundant work.","result":"complex_mixed improved from 142µs to 100µs (-30%). large_doc_entities improved from 1087µs to 737µs (-32%)."}}
{"run":11,"commit":"7c10891","metric":100.64,"metrics":{"complex_mixed_all_short_circuits":0,"complex_mixed_any_short_circuits":0,"complex_mixed_chain_traversals":0,"complex_mixed_entity_detection_calls":9,"complex_mixed_language_detect_calls":0,"complex_mixed_lower_allocations":1,"complex_mixed_lower_bytes":1560,"complex_mixed_max_chain_depth":0,"complex_mixed_not_short_circuits":1,"complex_mixed_predicate_evals":33,"complex_mixed_predicate_false":11,"complex_mixed_predicate_true":20,"complex_mixed_regex_cache_hits":1,"complex_mixed_regex_cache_misses":0,"complex_mixed_rule_evals":32,"complex_mixed_section_scan_calls":1,"complex_mixed_semantic_similarity_calls":2,"complex_mixed_tokenize_calls":2,"complex_mixed_tokens_produced":490,"complex_mixed_total_µs":20129,"complex_mixed_triggered_rules":21,"complex_mixed_url_extract_calls":1,"large_doc_entities_all_short_circuits":0,"large_doc_entities_any_short_circuits":0,"large_doc_entities_chain_traversals":0,"large_doc_entities_entity_detection_calls":9,"large_doc_entities_language_detect_calls":0,"large_doc_entities_lower_allocations":1,"large_doc_entities_lower_bytes":11162,"large_doc_entities_max_chain_depth":0,"large_doc_entities_not_short_circuits":1,"large_doc_entities_per_iter_µs":734.46,"large_doc_entities_predicate_evals":33,"large_doc_entities_predicate_false":11,"large_doc_entities_predicate_true":20,"large_doc_entities_regex_cache_hits":1,"large_doc_entities_regex_cache_misses":0,"large_doc_entities_rule_evals":32,"large_doc_entities_section_scan_calls":1,"large_doc_entities_semantic_similarity_calls":2,"large_doc_entities_tokenize_calls":2,"large_doc_entities_tokens_produced":4892,"large_doc_entities_total_µs":73446,"large_doc_entities_triggered_rules":21,"large_doc_entities_url_extract_calls":1,"nested_deep_all_short_circuits":8,"nested_deep_any_short_circuits":2,"nested_deep_chain_traversals":0,"nested_deep_entity_detection_calls":2,"nested_deep_language_detect_calls":1,"nested_deep_lower_allocations":1,"nested_deep_lower_bytes":1560,"nested_deep_max_chain_depth":0,"nested_deep_not_short_circuits":1,"nested_deep_per_iter_µs":96.64,"nested_deep_predicate_evals":33,"nested_deep_predicate_false":16,"nested_deep_predicate_true":16,"nested_deep_regex_cache_hits":0,"nested_deep_regex_cache_misses":0,"nested_deep_rule_evals":9,"nested_deep_section_scan_calls":1,"nested_deep_semantic_similarity_calls":1,"nested_deep_tokenize_calls":0,"nested_deep_tokens_produced":0,"nested_deep_total_µs":19327,"nested_deep_triggered_rules":4,"nested_deep_url_extract_calls":1},"status":"keep","description":"Zero-allocation tokenize_iter for semantic embedding avoids Vec<String> allocation","timestamp":1777749716440,"segment":1,"confidence":3.744527303343757,"asi":{"hypothesis":"tokenize() allocates a Vec<String> with thousands of small String allocations for large docs. Using tokenize_iter() in embed() avoids all allocations, saving time and reducing GC pressure.","result":"complex_mixed ~100µs (stable). large_doc_entities improved from 737µs to 734µs (-0.4%). Small but consistent win on the most expensive path."}}
{"run":12,"commit":"7a44320","metric":94.28,"metrics":{"complex_mixed_all_short_circuits":0,"complex_mixed_any_short_circuits":0,"complex_mixed_chain_traversals":0,"complex_mixed_entity_detection_calls":9,"complex_mixed_language_detect_calls":0,"complex_mixed_lower_allocations":1,"complex_mixed_lower_bytes":1560,"complex_mixed_max_chain_depth":0,"complex_mixed_not_short_circuits":1,"complex_mixed_predicate_evals":33,"complex_mixed_predicate_false":11,"complex_mixed_predicate_true":20,"complex_mixed_regex_cache_hits":1,"complex_mixed_regex_cache_misses":0,"complex_mixed_rule_evals":32,"complex_mixed_section_scan_calls":1,"complex_mixed_semantic_similarity_calls":2,"complex_mixed_tokenize_calls":2,"complex_mixed_tokens_produced":490,"complex_mixed_total_µs":18856,"complex_mixed_triggered_rules":21,"complex_mixed_url_extract_calls":1,"large_doc_entities_all_short_circuits":0,"large_doc_entities_any_short_circuits":0,"large_doc_entities_chain_traversals":0,"large_doc_entities_entity_detection_calls":9,"large_doc_entities_language_detect_calls":0,"large_doc_entities_lower_allocations":1,"large_doc_entities_lower_bytes":11162,"large_doc_entities_max_chain_depth":0,"large_doc_entities_not_short_circuits":1,"large_doc_entities_per_iter_µs":684.98,"large_doc_entities_predicate_evals":33,"large_doc_entities_predicate_false":11,"large_doc_entities_predicate_true":20,"large_doc_entities_regex_cache_hits":1,"large_doc_entities_regex_cache_misses":0,"large_doc_entities_rule_evals":32,"large_doc_entities_section_scan_calls":1,"large_doc_entities_semantic_similarity_calls":2,"large_doc_entities_tokenize_calls":2,"large_doc_entities_tokens_produced":4892,"large_doc_entities_total_µs":68498,"large_doc_entities_triggered_rules":21,"large_doc_entities_url_extract_calls":1,"nested_deep_all_short_circuits":8,"nested_deep_any_short_circuits":2,"nested_deep_chain_traversals":0,"nested_deep_entity_detection_calls":2,"nested_deep_language_detect_calls":1,"nested_deep_lower_allocations":1,"nested_deep_lower_bytes":1560,"nested_deep_max_chain_depth":0,"nested_deep_not_short_circuits":1,"nested_deep_per_iter_µs":92.63,"nested_deep_predicate_evals":33,"nested_deep_predicate_false":16,"nested_deep_predicate_true":16,"nested_deep_regex_cache_hits":0,"nested_deep_regex_cache_misses":0,"nested_deep_rule_evals":9,"nested_deep_section_scan_calls":1,"nested_deep_semantic_similarity_calls":1,"nested_deep_tokenize_calls":0,"nested_deep_tokens_produced":0,"nested_deep_total_µs":18526,"nested_deep_triggered_rules":4,"nested_deep_url_extract_calls":1},"status":"keep","description":"Use FxHashMap/FxHashSet for RepeatedToken and TypeTokenRatioBelow predicates","timestamp":1777750044881,"segment":1,"confidence":12.912576687116571}
