{"run":91,"commit":"4ec5a3a","metric":0.04,"metrics":{"complex_mixed_all_short_circuits":0,"complex_mixed_any_short_circuits":0,"complex_mixed_chain_traversals":0,"complex_mixed_entity_detection_calls":0,"complex_mixed_language_detect_calls":0,"complex_mixed_lower_allocations":0,"complex_mixed_lower_bytes":0,"complex_mixed_max_chain_depth":0,"complex_mixed_not_short_circuits":0,"complex_mixed_predicate_evals":0,"complex_mixed_predicate_false":0,"complex_mixed_predicate_true":0,"complex_mixed_regex_cache_hits":0,"complex_mixed_regex_cache_misses":0,"complex_mixed_rule_evals":22,"complex_mixed_section_scan_calls":0,"complex_mixed_semantic_similarity_calls":0,"complex_mixed_tokenize_calls":0,"complex_mixed_tokens_produced":0,"complex_mixed_total_µs":8,"complex_mixed_triggered_rules":22,"complex_mixed_url_extract_calls":0,"large_doc_entities_all_short_circuits":0,"large_doc_entities_any_short_circuits":0,"large_doc_entities_chain_traversals":0,"large_doc_entities_entity_detection_calls":0,"large_doc_entities_language_detect_calls":0,"large_doc_entities_lower_allocations":0,"large_doc_entities_lower_bytes":0,"large_doc_entities_max_chain_depth":0,"large_doc_entities_not_short_circuits":0,"large_doc_entities_per_iter_µs":0.04,"large_doc_entities_predicate_evals":0,"large_doc_entities_predicate_false":0,"large_doc_entities_predicate_true":0,"large_doc_entities_regex_cache_hits":0,"large_doc_entities_regex_cache_misses":0,"large_doc_entities_rule_evals":22,"large_doc_entities_section_scan_calls":0,"large_doc_entities_semantic_similarity_calls":0,"large_doc_entities_tokenize_calls":0,"large_doc_entities_tokens_produced":0,"large_doc_entities_total_µs":4,"large_doc_entities_triggered_rules":22,"large_doc_entities_url_extract_calls":0,"nested_deep_all_short_circuits":0,"nested_deep_any_short_circuits":0,"nested_deep_chain_traversals":0,"nested_deep_entity_detection_calls":0,"nested_deep_language_detect_calls":0,"nested_deep_lower_allocations":0,"nested_deep_lower_bytes":0,"nested_deep_max_chain_depth":0,"nested_deep_not_short_circuits":0,"nested_deep_per_iter_µs":0.025,"nested_deep_predicate_evals":0,"nested_deep_predicate_false":0,"nested_deep_predicate_true":0,"nested_deep_regex_cache_hits":0,"nested_deep_regex_cache_misses":0,"nested_deep_rule_evals":4,"nested_deep_section_scan_calls":0,"nested_deep_semantic_similarity_calls":0,"nested_deep_tokenize_calls":0,"nested_deep_tokens_produced":0,"nested_deep_total_µs":5,"nested_deep_triggered_rules":4,"nested_deep_url_extract_calls":0,"single_shot_complex_per_iter_µs":60.75,"single_shot_large_doc_per_iter_µs":428.92,"single_shot_nested_per_iter_µs":35.01},"status":"keep","description":"Implement missing has_credit_card_fast and count_credit_cards functions; fix iratxo-cli SemanticMatch pattern match for boxed variant","timestamp":1778458419483,"segment":3,"confidence":6.000000000000003,"asi":{"hypothesis":"Missing functions caused compilation failures on clean builds. Adding fast credit card detection with byte-level scanning and Luhn validation. Also fixed iratxo-cli compilation error with SemanticMatch tuple variant pattern.","single_shot_complex_µs":60.75,"single_shot_large_doc_µs":428.92,"single_shot_nested_µs":35.01}}
{"run":92,"commit":"3254dc7","metric":0.04,"metrics":{"complex_mixed_all_short_circuits":0,"complex_mixed_any_short_circuits":0,"complex_mixed_chain_traversals":0,"complex_mixed_entity_detection_calls":0,"complex_mixed_language_detect_calls":0,"complex_mixed_lower_allocations":0,"complex_mixed_lower_bytes":0,"complex_mixed_max_chain_depth":0,"complex_mixed_not_short_circuits":0,"complex_mixed_predicate_evals":0,"complex_mixed_predicate_false":0,"complex_mixed_predicate_true":0,"complex_mixed_regex_cache_hits":0,"complex_mixed_regex_cache_misses":0,"complex_mixed_rule_evals":22,"complex_mixed_section_scan_calls":0,"complex_mixed_semantic_similarity_calls":0,"complex_mixed_tokenize_calls":0,"complex_mixed_tokens_produced":0,"complex_mixed_total_µs":8,"complex_mixed_triggered_rules":22,"complex_mixed_url_extract_calls":0,"large_doc_entities_all_short_circuits":0,"large_doc_entities_any_short_circuits":0,"large_doc_entities_chain_traversals":0,"large_doc_entities_entity_detection_calls":0,"large_doc_entities_language_detect_calls":0,"large_doc_entities_lower_allocations":0,"large_doc_entities_lower_bytes":0,"large_doc_entities_max_chain_depth":0,"large_doc_entities_not_short_circuits":0,"large_doc_entities_per_iter_µs":0.04,"large_doc_entities_predicate_evals":0,"large_doc_entities_predicate_false":0,"large_doc_entities_predicate_true":0,"large_doc_entities_regex_cache_hits":0,"large_doc_entities_regex_cache_misses":0,"large_doc_entities_rule_evals":22,"large_doc_entities_section_scan_calls":0,"large_doc_entities_semantic_similarity_calls":0,"large_doc_entities_tokenize_calls":0,"large_doc_entities_tokens_produced":0,"large_doc_entities_total_µs":4,"large_doc_entities_triggered_rules":22,"large_doc_entities_url_extract_calls":0,"nested_deep_all_short_circuits":0,"nested_deep_any_short_circuits":0,"nested_deep_chain_traversals":0,"nested_deep_entity_detection_calls":0,"nested_deep_language_detect_calls":0,"nested_deep_lower_allocations":0,"nested_deep_lower_bytes":0,"nested_deep_max_chain_depth":0,"nested_deep_not_short_circuits":0,"nested_deep_per_iter_µs":0.025,"nested_deep_predicate_evals":0,"nested_deep_predicate_false":0,"nested_deep_predicate_true":0,"nested_deep_regex_cache_hits":0,"nested_deep_regex_cache_misses":0,"nested_deep_rule_evals":4,"nested_deep_section_scan_calls":0,"nested_deep_semantic_similarity_calls":0,"nested_deep_tokenize_calls":0,"nested_deep_tokens_produced":0,"nested_deep_total_µs":5,"nested_deep_triggered_rules":4,"nested_deep_url_extract_calls":0,"single_shot_complex_per_iter_µs":58.64,"single_shot_large_doc_per_iter_µs":419.4,"single_shot_nested_per_iter_µs":33},"status":"keep","description":"Add memchr-based fast paths for IBAN, date, hashtag, and mention entity detection; implement missing credit card functions; fix iratxo-cli compilation","timestamp":1778458822558,"segment":3,"confidence":6.000000000000003,"asi":{"hypothesis":"Replace regex-based entity detection for IBAN, date, hashtag, mention with byte-level scanners. Implement missing credit card functions. Fix iratxo-cli SemanticMatch pattern for boxed variant.","single_shot_complex_µs":58.64,"single_shot_large_doc_µs":419.4,"single_shot_nested_µs":33}}
{"run":93,"commit":"6617273","metric":0.035,"metrics":{"complex_mixed_all_short_circuits":0,"complex_mixed_any_short_circuits":0,"complex_mixed_chain_traversals":0,"complex_mixed_entity_detection_calls":0,"complex_mixed_language_detect_calls":0,"complex_mixed_lower_allocations":0,"complex_mixed_lower_bytes":0,"complex_mixed_max_chain_depth":0,"complex_mixed_not_short_circuits":0,"complex_mixed_predicate_evals":0,"complex_mixed_predicate_false":0,"complex_mixed_predicate_true":0,"complex_mixed_regex_cache_hits":0,"complex_mixed_regex_cache_misses":0,"complex_mixed_rule_evals":21,"complex_mixed_section_scan_calls":0,"complex_mixed_semantic_similarity_calls":0,"complex_mixed_tokenize_calls":0,"complex_mixed_tokens_produced":0,"complex_mixed_total_µs":7,"complex_mixed_triggered_rules":21,"complex_mixed_url_extract_calls":0,"large_doc_entities_all_short_circuits":0,"large_doc_entities_any_short_circuits":0,"large_doc_entities_chain_traversals":0,"large_doc_entities_entity_detection_calls":0,"large_doc_entities_language_detect_calls":0,"large_doc_entities_lower_allocations":0,"large_doc_entities_lower_bytes":0,"large_doc_entities_max_chain_depth":0,"large_doc_entities_not_short_circuits":0,"large_doc_entities_per_iter_µs":0.03,"large_doc_entities_predicate_evals":0,"large_doc_entities_predicate_false":0,"large_doc_entities_predicate_true":0,"large_doc_entities_regex_cache_hits":0,"large_doc_entities_regex_cache_misses":0,"large_doc_entities_rule_evals":21,"large_doc_entities_section_scan_calls":0,"large_doc_entities_semantic_similarity_calls":0,"large_doc_entities_tokenize_calls":0,"large_doc_entities_tokens_produced":0,"large_doc_entities_total_µs":3,"large_doc_entities_triggered_rules":21,"large_doc_entities_url_extract_calls":0,"nested_deep_all_short_circuits":0,"nested_deep_any_short_circuits":0,"nested_deep_chain_traversals":0,"nested_deep_entity_detection_calls":0,"nested_deep_language_detect_calls":0,"nested_deep_lower_allocations":0,"nested_deep_lower_bytes":0,"nested_deep_max_chain_depth":0,"nested_deep_not_short_circuits":0,"nested_deep_per_iter_µs":0.025,"nested_deep_predicate_evals":0,"nested_deep_predicate_false":0,"nested_deep_predicate_true":0,"nested_deep_regex_cache_hits":0,"nested_deep_regex_cache_misses":0,"nested_deep_rule_evals":4,"nested_deep_section_scan_calls":0,"nested_deep_semantic_similarity_calls":0,"nested_deep_tokenize_calls":0,"nested_deep_tokens_produced":0,"nested_deep_total_µs":5,"nested_deep_triggered_rules":4,"nested_deep_url_extract_calls":0,"single_shot_complex_per_iter_µs":58.68,"single_shot_large_doc_per_iter_µs":430.88,"single_shot_nested_per_iter_µs":33.73},"status":"keep","description":"Fix token counting bug in counts_impl: tokens was not incremented during word boundary detection, causing incorrect MinLength/MaxLength results","timestamp":1778459031239,"segment":3,"confidence":6.000000000000003,"asi":{"hypothesis":"counts_impl had a bug where tokens was only incremented at the end of input, not when words were completed by whitespace or sentence punctuation. This caused short_msg (max_length: 5) to incorrectly trigger on long texts. Fixing it changes triggered_rules from 22 to 21.","single_shot_complex_µs":58.68,"single_shot_large_doc_µs":430.88,"single_shot_nested_µs":33.73,"correctness_fix":"tokens counter now properly increments on word boundaries"}}
{"run":94,"commit":"d8307ed","metric":0.04,"metrics":{"complex_mixed_all_short_circuits":0,"complex_mixed_any_short_circuits":0,"complex_mixed_chain_traversals":0,"complex_mixed_entity_detection_calls":0,"complex_mixed_language_detect_calls":0,"complex_mixed_lower_allocations":0,"complex_mixed_lower_bytes":0,"complex_mixed_max_chain_depth":0,"complex_mixed_not_short_circuits":0,"complex_mixed_predicate_evals":0,"complex_mixed_predicate_false":0,"complex_mixed_predicate_true":0,"complex_mixed_regex_cache_hits":0,"complex_mixed_regex_cache_misses":0,"complex_mixed_rule_evals":21,"complex_mixed_section_scan_calls":0,"complex_mixed_semantic_similarity_calls":0,"complex_mixed_tokenize_calls":0,"complex_mixed_tokens_produced":0,"complex_mixed_total_µs":8,"complex_mixed_triggered_rules":21,"complex_mixed_url_extract_calls":0,"large_doc_entities_all_short_circuits":0,"large_doc_entities_any_short_circuits":0,"large_doc_entities_chain_traversals":0,"large_doc_entities_entity_detection_calls":0,"large_doc_entities_language_detect_calls":0,"large_doc_entities_lower_allocations":0,"large_doc_entities_lower_bytes":0,"large_doc_entities_max_chain_depth":0,"large_doc_entities_not_short_circuits":0,"large_doc_entities_per_iter_µs":0.04,"large_doc_entities_predicate_evals":0,"large_doc_entities_predicate_false":0,"large_doc_entities_predicate_true":0,"large_doc_entities_regex_cache_hits":0,"large_doc_entities_regex_cache_misses":0,"large_doc_entities_rule_evals":21,"large_doc_entities_section_scan_calls":0,"large_doc_entities_semantic_similarity_calls":0,"large_doc_entities_tokenize_calls":0,"large_doc_entities_tokens_produced":0,"large_doc_entities_total_µs":4,"large_doc_entities_triggered_rules":21,"large_doc_entities_url_extract_calls":0,"nested_deep_all_short_circuits":0,"nested_deep_any_short_circuits":0,"nested_deep_chain_traversals":0,"nested_deep_entity_detection_calls":0,"nested_deep_language_detect_calls":0,"nested_deep_lower_allocations":0,"nested_deep_lower_bytes":0,"nested_deep_max_chain_depth":0,"nested_deep_not_short_circuits":0,"nested_deep_per_iter_µs":0.025,"nested_deep_predicate_evals":0,"nested_deep_predicate_false":0,"nested_deep_predicate_true":0,"nested_deep_regex_cache_hits":0,"nested_deep_regex_cache_misses":0,"nested_deep_rule_evals":4,"nested_deep_section_scan_calls":0,"nested_deep_semantic_similarity_calls":0,"nested_deep_tokenize_calls":0,"nested_deep_tokens_produced":0,"nested_deep_total_µs":5,"nested_deep_triggered_rules":4,"nested_deep_url_extract_calls":0,"single_shot_complex_per_iter_µs":58.58,"single_shot_large_doc_per_iter_µs":426.68,"single_shot_nested_per_iter_µs":33.57},"status":"keep","description":"Use FxHashMap for synonym index and ASCII fast path for stem length in semantic embedding","timestamp":1778459259239,"segment":3,"confidence":6.000000000000003,"asi":{"hypothesis":"FxHashMap has faster lookups than std HashMap for synonym canonicalization. ASCII fast path avoids char iteration for stem length check.","single_shot_complex_µs":58.58,"single_shot_large_doc_µs":426.68,"single_shot_nested_µs":33.57}}
{"run":95,"commit":"a0cc37e","metric":0.045,"metrics":{"complex_mixed_all_short_circuits":0,"complex_mixed_any_short_circuits":0,"complex_mixed_chain_traversals":0,"complex_mixed_entity_detection_calls":0,"complex_mixed_language_detect_calls":0,"complex_mixed_lower_allocations":0,"complex_mixed_lower_bytes":0,"complex_mixed_max_chain_depth":0,"complex_mixed_not_short_circuits":0,"complex_mixed_predicate_evals":0,"complex_mixed_predicate_false":0,"complex_mixed_predicate_true":0,"complex_mixed_regex_cache_hits":0,"complex_mixed_regex_cache_misses":0,"complex_mixed_rule_evals":21,"complex_mixed_section_scan_calls":0,"complex_mixed_semantic_similarity_calls":0,"complex_mixed_tokenize_calls":0,"complex_mixed_tokens_produced":0,"complex_mixed_total_µs":9,"complex_mixed_triggered_rules":21,"complex_mixed_url_extract_calls":0,"large_doc_entities_all_short_circuits":0,"large_doc_entities_any_short_circuits":0,"large_doc_entities_chain_traversals":0,"large_doc_entities_entity_detection_calls":0,"large_doc_entities_language_detect_calls":0,"large_doc_entities_lower_allocations":0,"large_doc_entities_lower_bytes":0,"large_doc_entities_max_chain_depth":0,"large_doc_entities_not_short_circuits":0,"large_doc_entities_per_iter_µs":0.04,"large_doc_entities_predicate_evals":0,"large_doc_entities_predicate_false":0,"large_doc_entities_predicate_true":0,"large_doc_entities_regex_cache_hits":0,"large_doc_entities_regex_cache_misses":0,"large_doc_entities_rule_evals":21,"large_doc_entities_section_scan_calls":0,"large_doc_entities_semantic_similarity_calls":0,"large_doc_entities_tokenize_calls":0,"large_doc_entities_tokens_produced":0,"large_doc_entities_total_µs":4,"large_doc_entities_triggered_rules":21,"large_doc_entities_url_extract_calls":0,"nested_deep_all_short_circuits":0,"nested_deep_any_short_circuits":0,"nested_deep_chain_traversals":0,"nested_deep_entity_detection_calls":0,"nested_deep_language_detect_calls":0,"nested_deep_lower_allocations":0,"nested_deep_lower_bytes":0,"nested_deep_max_chain_depth":0,"nested_deep_not_short_circuits":0,"nested_deep_per_iter_µs":0.035,"nested_deep_predicate_evals":0,"nested_deep_predicate_false":0,"nested_deep_predicate_true":0,"nested_deep_regex_cache_hits":0,"nested_deep_regex_cache_misses":0,"nested_deep_rule_evals":4,"nested_deep_section_scan_calls":0,"nested_deep_semantic_similarity_calls":0,"nested_deep_tokenize_calls":0,"nested_deep_tokens_produced":0,"nested_deep_total_µs":7,"nested_deep_triggered_rules":4,"nested_deep_url_extract_calls":0,"single_shot_complex_per_iter_µs":69.93,"single_shot_large_doc_per_iter_µs":483.26,"single_shot_nested_per_iter_µs":33.46},"status":"keep","description":"Use pre-lowered input in detect_language to avoid double lowercasing; use tokenize_iter to avoid per-token allocation","timestamp":1778459491805,"segment":3,"confidence":6.000000000000003,"asi":{"hypothesis":"detect_language was redundantly lowercasing the input even when Ctx already had a lowercased version. Using detect_language_lowered avoids this allocation. tokenize_iter avoids per-token String allocation during language detection.","single_shot_complex_µs":69.93,"single_shot_large_doc_µs":483.26,"single_shot_nested_µs":33.46}}
{"run":96,"commit":"1269d46","metric":0.04,"metrics":{"complex_mixed_all_short_circuits":0,"complex_mixed_any_short_circuits":0,"complex_mixed_chain_traversals":0,"complex_mixed_entity_detection_calls":0,"complex_mixed_language_detect_calls":0,"complex_mixed_lower_allocations":0,"complex_mixed_lower_bytes":0,"complex_mixed_max_chain_depth":0,"complex_mixed_not_short_circuits":0,"complex_mixed_predicate_evals":0,"complex_mixed_predicate_false":0,"complex_mixed_predicate_true":0,"complex_mixed_regex_cache_hits":0,"complex_mixed_regex_cache_misses":0,"complex_mixed_rule_evals":21,"complex_mixed_section_scan_calls":0,"complex_mixed_semantic_similarity_calls":0,"complex_mixed_tokenize_calls":0,"complex_mixed_tokens_produced":0,"complex_mixed_total_µs":8,"complex_mixed_triggered_rules":21,"complex_mixed_url_extract_calls":0,"large_doc_entities_all_short_circuits":0,"large_doc_entities_any_short_circuits":0,"large_doc_entities_chain_traversals":0,"large_doc_entities_entity_detection_calls":0,"large_doc_entities_language_detect_calls":0,"large_doc_entities_lower_allocations":0,"large_doc_entities_lower_bytes":0,"large_doc_entities_max_chain_depth":0,"large_doc_entities_not_short_circuits":0,"large_doc_entities_per_iter_µs":0.04,"large_doc_entities_predicate_evals":0,"large_doc_entities_predicate_false":0,"large_doc_entities_predicate_true":0,"large_doc_entities_regex_cache_hits":0,"large_doc_entities_regex_cache_misses":0,"large_doc_entities_rule_evals":21,"large_doc_entities_section_scan_calls":0,"large_doc_entities_semantic_similarity_calls":0,"large_doc_entities_tokenize_calls":0,"large_doc_entities_tokens_produced":0,"large_doc_entities_total_µs":4,"large_doc_entities_triggered_rules":21,"large_doc_entities_url_extract_calls":0,"nested_deep_all_short_circuits":0,"nested_deep_any_short_circuits":0,"nested_deep_chain_traversals":0,"nested_deep_entity_detection_calls":0,"nested_deep_language_detect_calls":0,"nested_deep_lower_allocations":0,"nested_deep_lower_bytes":0,"nested_deep_max_chain_depth":0,"nested_deep_not_short_circuits":0,"nested_deep_per_iter_µs":0.03,"nested_deep_predicate_evals":0,"nested_deep_predicate_false":0,"nested_deep_predicate_true":0,"nested_deep_regex_cache_hits":0,"nested_deep_regex_cache_misses":0,"nested_deep_rule_evals":4,"nested_deep_section_scan_calls":0,"nested_deep_semantic_similarity_calls":0,"nested_deep_tokenize_calls":0,"nested_deep_tokens_produced":0,"nested_deep_total_µs":6,"nested_deep_triggered_rules":4,"nested_deep_url_extract_calls":0,"single_shot_complex_per_iter_µs":64.97,"single_shot_large_doc_per_iter_µs":459.9,"single_shot_nested_per_iter_µs":31.43},"status":"keep","description":"Pass pre-lowered input to has_section_impl to avoid redundant to_lowercase() calls for HTML heading matching","timestamp":1778459741366,"segment":3,"confidence":6.000000000000003,"asi":{"hypothesis":"has_section_impl was lowercasing the entire input for HTML heading matching even though Ctx already had a lowercased version. Passing the pre-lowered input saves one to_lowercase() allocation per evaluation.","single_shot_complex_µs":64.97,"single_shot_large_doc_µs":459.9,"single_shot_nested_µs":31.43}}
