{"run":97,"commit":"023a0cb","metric":0.04,"metrics":{"complex_mixed_all_short_circuits":0,"complex_mixed_any_short_circuits":0,"complex_mixed_chain_traversals":0,"complex_mixed_entity_detection_calls":0,"complex_mixed_language_detect_calls":0,"complex_mixed_lower_allocations":0,"complex_mixed_lower_bytes":0,"complex_mixed_max_chain_depth":0,"complex_mixed_not_short_circuits":0,"complex_mixed_predicate_evals":0,"complex_mixed_predicate_false":0,"complex_mixed_predicate_true":0,"complex_mixed_regex_cache_hits":0,"complex_mixed_regex_cache_misses":0,"complex_mixed_rule_evals":21,"complex_mixed_section_scan_calls":0,"complex_mixed_semantic_similarity_calls":0,"complex_mixed_tokenize_calls":0,"complex_mixed_tokens_produced":0,"complex_mixed_total_µs":8,"complex_mixed_triggered_rules":21,"complex_mixed_url_extract_calls":0,"large_doc_entities_all_short_circuits":0,"large_doc_entities_any_short_circuits":0,"large_doc_entities_chain_traversals":0,"large_doc_entities_entity_detection_calls":0,"large_doc_entities_language_detect_calls":0,"large_doc_entities_lower_allocations":0,"large_doc_entities_lower_bytes":0,"large_doc_entities_max_chain_depth":0,"large_doc_entities_not_short_circuits":0,"large_doc_entities_per_iter_µs":0.04,"large_doc_entities_predicate_evals":0,"large_doc_entities_predicate_false":0,"large_doc_entities_predicate_true":0,"large_doc_entities_regex_cache_hits":0,"large_doc_entities_regex_cache_misses":0,"large_doc_entities_rule_evals":21,"large_doc_entities_section_scan_calls":0,"large_doc_entities_semantic_similarity_calls":0,"large_doc_entities_tokenize_calls":0,"large_doc_entities_tokens_produced":0,"large_doc_entities_total_µs":4,"large_doc_entities_triggered_rules":21,"large_doc_entities_url_extract_calls":0,"nested_deep_all_short_circuits":0,"nested_deep_any_short_circuits":0,"nested_deep_chain_traversals":0,"nested_deep_entity_detection_calls":0,"nested_deep_language_detect_calls":0,"nested_deep_lower_allocations":0,"nested_deep_lower_bytes":0,"nested_deep_max_chain_depth":0,"nested_deep_not_short_circuits":0,"nested_deep_per_iter_µs":0.025,"nested_deep_predicate_evals":0,"nested_deep_predicate_false":0,"nested_deep_predicate_true":0,"nested_deep_regex_cache_hits":0,"nested_deep_regex_cache_misses":0,"nested_deep_rule_evals":4,"nested_deep_section_scan_calls":0,"nested_deep_semantic_similarity_calls":0,"nested_deep_tokenize_calls":0,"nested_deep_tokens_produced":0,"nested_deep_total_µs":5,"nested_deep_triggered_rules":4,"nested_deep_url_extract_calls":0,"single_shot_complex_per_iter_µs":57.48,"single_shot_large_doc_per_iter_µs":417.6,"single_shot_nested_per_iter_µs":27.73},"status":"keep","description":"Skip stopword binary search for tokens longer than MAX_STOPWORD_LEN (12 chars) in semantic embedding","timestamp":1778459963475,"segment":3,"confidence":6.000000000000003,"asi":{"hypothesis":"Most tokens in long documents are longer than any stopword. Skipping the binary search for tokens >12 chars saves significant time in semantic embedding.","single_shot_complex_µs":57.48,"single_shot_large_doc_µs":417.6,"single_shot_nested_µs":27.73}}
{"run":98,"commit":"2555b53","metric":0.04,"metrics":{"complex_mixed_all_short_circuits":0,"complex_mixed_any_short_circuits":0,"complex_mixed_chain_traversals":0,"complex_mixed_entity_detection_calls":0,"complex_mixed_language_detect_calls":0,"complex_mixed_lower_allocations":0,"complex_mixed_lower_bytes":0,"complex_mixed_max_chain_depth":0,"complex_mixed_not_short_circuits":0,"complex_mixed_predicate_evals":0,"complex_mixed_predicate_false":0,"complex_mixed_predicate_true":0,"complex_mixed_regex_cache_hits":0,"complex_mixed_regex_cache_misses":0,"complex_mixed_rule_evals":21,"complex_mixed_section_scan_calls":0,"complex_mixed_semantic_similarity_calls":0,"complex_mixed_tokenize_calls":0,"complex_mixed_tokens_produced":0,"complex_mixed_total_µs":8,"complex_mixed_triggered_rules":21,"complex_mixed_url_extract_calls":0,"large_doc_entities_all_short_circuits":0,"large_doc_entities_any_short_circuits":0,"large_doc_entities_chain_traversals":0,"large_doc_entities_entity_detection_calls":0,"large_doc_entities_language_detect_calls":0,"large_doc_entities_lower_allocations":0,"large_doc_entities_lower_bytes":0,"large_doc_entities_max_chain_depth":0,"large_doc_entities_not_short_circuits":0,"large_doc_entities_per_iter_µs":0.04,"large_doc_entities_predicate_evals":0,"large_doc_entities_predicate_false":0,"large_doc_entities_predicate_true":0,"large_doc_entities_regex_cache_hits":0,"large_doc_entities_regex_cache_misses":0,"large_doc_entities_rule_evals":21,"large_doc_entities_section_scan_calls":0,"large_doc_entities_semantic_similarity_calls":0,"large_doc_entities_tokenize_calls":0,"large_doc_entities_tokens_produced":0,"large_doc_entities_total_µs":4,"large_doc_entities_triggered_rules":21,"large_doc_entities_url_extract_calls":0,"nested_deep_all_short_circuits":0,"nested_deep_any_short_circuits":0,"nested_deep_chain_traversals":0,"nested_deep_entity_detection_calls":0,"nested_deep_language_detect_calls":0,"nested_deep_lower_allocations":0,"nested_deep_lower_bytes":0,"nested_deep_max_chain_depth":0,"nested_deep_not_short_circuits":0,"nested_deep_per_iter_µs":0.025,"nested_deep_predicate_evals":0,"nested_deep_predicate_false":0,"nested_deep_predicate_true":0,"nested_deep_regex_cache_hits":0,"nested_deep_regex_cache_misses":0,"nested_deep_rule_evals":4,"nested_deep_section_scan_calls":0,"nested_deep_semantic_similarity_calls":0,"nested_deep_tokenize_calls":0,"nested_deep_tokens_produced":0,"nested_deep_total_µs":5,"nested_deep_triggered_rules":4,"nested_deep_url_extract_calls":0,"single_shot_complex_per_iter_µs":56.93,"single_shot_large_doc_per_iter_µs":418,"single_shot_nested_per_iter_µs":27.72},"status":"keep","description":"Add ASCII fast path for word_contains to simplify boundary checks","timestamp":1778460200611,"segment":3,"confidence":12.000000000000005,"asi":{"hypothesis":"word_contains boundary checks included prev < 0x80 and next < 0x8 checks to avoid matching inside multi-byte UTF-8 sequences. For ASCII haystacks (the common case), these checks are unnecessary. Adding an ASCII-only fast path removes them.","single_shot_complex_µs":56.93,"single_shot_large_doc_µs":418,"single_shot_nested_µs":27.72}}
{"run":99,"commit":"8843018","metric":0.04,"metrics":{"complex_mixed_all_short_circuits":0,"complex_mixed_any_short_circuits":0,"complex_mixed_chain_traversals":0,"complex_mixed_entity_detection_calls":0,"complex_mixed_language_detect_calls":0,"complex_mixed_lower_allocations":0,"complex_mixed_lower_bytes":0,"complex_mixed_max_chain_depth":0,"complex_mixed_not_short_circuits":0,"complex_mixed_predicate_evals":0,"complex_mixed_predicate_false":0,"complex_mixed_predicate_true":0,"complex_mixed_regex_cache_hits":0,"complex_mixed_regex_cache_misses":0,"complex_mixed_rule_evals":21,"complex_mixed_section_scan_calls":0,"complex_mixed_semantic_similarity_calls":0,"complex_mixed_tokenize_calls":0,"complex_mixed_tokens_produced":0,"complex_mixed_total_µs":8,"complex_mixed_triggered_rules":21,"complex_mixed_url_extract_calls":0,"large_doc_entities_all_short_circuits":0,"large_doc_entities_any_short_circuits":0,"large_doc_entities_chain_traversals":0,"large_doc_entities_entity_detection_calls":0,"large_doc_entities_language_detect_calls":0,"large_doc_entities_lower_allocations":0,"large_doc_entities_lower_bytes":0,"large_doc_entities_max_chain_depth":0,"large_doc_entities_not_short_circuits":0,"large_doc_entities_per_iter_µs":0.04,"large_doc_entities_predicate_evals":0,"large_doc_entities_predicate_false":0,"large_doc_entities_predicate_true":0,"large_doc_entities_regex_cache_hits":0,"large_doc_entities_regex_cache_misses":0,"large_doc_entities_rule_evals":21,"large_doc_entities_section_scan_calls":0,"large_doc_entities_semantic_similarity_calls":0,"large_doc_entities_tokenize_calls":0,"large_doc_entities_tokens_produced":0,"large_doc_entities_total_µs":4,"large_doc_entities_triggered_rules":21,"large_doc_entities_url_extract_calls":0,"nested_deep_all_short_circuits":0,"nested_deep_any_short_circuits":0,"nested_deep_chain_traversals":0,"nested_deep_entity_detection_calls":0,"nested_deep_language_detect_calls":0,"nested_deep_lower_allocations":0,"nested_deep_lower_bytes":0,"nested_deep_max_chain_depth":0,"nested_deep_not_short_circuits":0,"nested_deep_per_iter_µs":0.025,"nested_deep_predicate_evals":0,"nested_deep_predicate_false":0,"nested_deep_predicate_true":0,"nested_deep_regex_cache_hits":0,"nested_deep_regex_cache_misses":0,"nested_deep_rule_evals":4,"nested_deep_section_scan_calls":0,"nested_deep_semantic_similarity_calls":0,"nested_deep_tokenize_calls":0,"nested_deep_tokens_produced":0,"nested_deep_total_µs":5,"nested_deep_triggered_rules":4,"nested_deep_url_extract_calls":0,"single_shot_complex_per_iter_µs":57.32,"single_shot_large_doc_per_iter_µs":425.18,"single_shot_nested_per_iter_µs":27.67},"status":"keep","description":"Route URL entity detection through url_hosts cache to avoid double input scanning","timestamp":1778460366376,"segment":3,"confidence":null,"asi":{"hypothesis":"Entity detection for URLs was scanning the input independently via url_hosts_impl, while HasUrlToDomain also scanned via Ctx::url_hosts(). For single-shot evaluations both missed cache. Routing URL entity detection through the cached Ctx::url_hosts() eliminates the redundant scan.","single_shot_complex_µs":57.32,"single_shot_large_doc_µs":425.18,"single_shot_nested_µs":27.67}}
{"run":100,"commit":"ad55f8e","metric":0.04,"metrics":{"complex_mixed_all_short_circuits":0,"complex_mixed_any_short_circuits":0,"complex_mixed_chain_traversals":0,"complex_mixed_entity_detection_calls":0,"complex_mixed_language_detect_calls":0,"complex_mixed_lower_allocations":0,"complex_mixed_lower_bytes":0,"complex_mixed_max_chain_depth":0,"complex_mixed_not_short_circuits":0,"complex_mixed_predicate_evals":0,"complex_mixed_predicate_false":0,"complex_mixed_predicate_true":0,"complex_mixed_regex_cache_hits":0,"complex_mixed_regex_cache_misses":0,"complex_mixed_rule_evals":21,"complex_mixed_section_scan_calls":0,"complex_mixed_semantic_similarity_calls":0,"complex_mixed_tokenize_calls":0,"complex_mixed_tokens_produced":0,"complex_mixed_total_µs":8,"complex_mixed_triggered_rules":21,"complex_mixed_url_extract_calls":0,"large_doc_entities_all_short_circuits":0,"large_doc_entities_any_short_circuits":0,"large_doc_entities_chain_traversals":0,"large_doc_entities_entity_detection_calls":0,"large_doc_entities_language_detect_calls":0,"large_doc_entities_lower_allocations":0,"large_doc_entities_lower_bytes":0,"large_doc_entities_max_chain_depth":0,"large_doc_entities_not_short_circuits":0,"large_doc_entities_per_iter_µs":0.04,"large_doc_entities_predicate_evals":0,"large_doc_entities_predicate_false":0,"large_doc_entities_predicate_true":0,"large_doc_entities_regex_cache_hits":0,"large_doc_entities_regex_cache_misses":0,"large_doc_entities_rule_evals":21,"large_doc_entities_section_scan_calls":0,"large_doc_entities_semantic_similarity_calls":0,"large_doc_entities_tokenize_calls":0,"large_doc_entities_tokens_produced":0,"large_doc_entities_total_µs":4,"large_doc_entities_triggered_rules":21,"large_doc_entities_url_extract_calls":0,"nested_deep_all_short_circuits":0,"nested_deep_any_short_circuits":0,"nested_deep_chain_traversals":0,"nested_deep_entity_detection_calls":0,"nested_deep_language_detect_calls":0,"nested_deep_lower_allocations":0,"nested_deep_lower_bytes":0,"nested_deep_max_chain_depth":0,"nested_deep_not_short_circuits":0,"nested_deep_per_iter_µs":0.025,"nested_deep_predicate_evals":0,"nested_deep_predicate_false":0,"nested_deep_predicate_true":0,"nested_deep_regex_cache_hits":0,"nested_deep_regex_cache_misses":0,"nested_deep_rule_evals":4,"nested_deep_section_scan_calls":0,"nested_deep_semantic_similarity_calls":0,"nested_deep_tokenize_calls":0,"nested_deep_tokens_produced":0,"nested_deep_total_µs":5,"nested_deep_triggered_rules":4,"nested_deep_url_extract_calls":0,"single_shot_complex_per_iter_µs":57.87,"single_shot_large_doc_per_iter_µs":415.24,"single_shot_nested_per_iter_µs":27.86},"status":"keep","description":"Use ASCII fast path for token length check in RepeatedToken predicate","timestamp":1778460530795,"segment":3,"confidence":null,"asi":{"hypothesis":"RepeatedToken was calling chars().count() on every token to filter short tokens. For ASCII inputs (the common case), tok.len() is equivalent and much faster.","single_shot_complex_µs":57.87,"single_shot_large_doc_µs":415.24,"single_shot_nested_µs":27.86}}
